Nombre_producto;Forma_entrega;Transportadora;Numero_seguimiento
Smart Watch + Audifonos Inalambricos I20 Ultra Max Suit Gris Color De La Caja Plateado 80-J-TQJ;Colecta de Mercado Envíos;MELI Logistics;MEL43281154615FMXDF01
Gimnasio Piano Bebe Musical Tapete Con Sonido, Giratorio ROMAN-AD-55;Colecta de Mercado Envíos;MELI Logistics;MEL43281160389FMXDF01
Escalera Multifuncional Plegable 16 Pasos Aluminio 4,7 MtsColor : GrisMX-300;Colecta de Mercado Envíos;MELI Logistics;MEL43279336693FMXDF01
Tapete De Juego Plegable Gateo Bebé 200x180x1 Cms Doble Faz TH-56;Colecta de Mercado Envíos;MELI Logistics;MEL43281296222FMXDF01
Batidor De Leche Eléctrico Espumador Cafe BaristaColor : Blanco | Voltaje : 110VDG-10;Colecta de Mercado Envíos;MELI Logistics;MEL43281275622FMXDF01
Tablet Net K7 Plus - Krono KRNO-175-F;Colecta de Mercado Envíos;MELI Logistics;MEL43281113013FMXDF01
Corrector Juanete Alivia El Dolor Silicona Suave X 2 ParesColor : Piel | Talla : unicaCorrector Juanete piel;Mercado Envíos Flex;TOR.TECHONOLOGY;43281091209
Repuestos Filtro Purificador De Agua Para El Grifo VMX-AD-5;Mercado Envíos Flex;TOR.TECHONOLOGY;43281043481
Linterna Tactica Recargable Metal Zoom Usb Estuche LI-7;Colecta de Mercado Envíos;MELI Logistics;MEL43280106370FMXDF01
Receptor Bluetooth Manos Libres Adaptador 3.5mm ADAPTADOR BLUETOOTH;Mercado Envíos Flex;TOR.TECHONOLOGY;43281030417
Compresor De Aire Automático Para Inflar Llantas De Carro CoColor : Amarillo | Voltaje : 12VRD-42;Colecta de Mercado Envíos;MELI Logistics;MEL43267442394FMXDF01
Batidor Manual Eléctrico Personal Espumador Base PortátilColor : NegroTQ-12;Colecta de Mercado Envíos;MELI Logistics;MEL43281173380FMXDF01
Tapete Extra Grande Plegable Para Bebé 200x180 Cm Doble Faz CACHA TAPETE-AD-48;Mercado Envíos Flex;TOR.TECHONOLOGY;43281158412
Maquina Patillera Recargable Vgr V-091 Profesional Trimmer Color Dorado PH-S-40;Colecta de Mercado Envíos;MELI Logistics;MEL43281143918FMXDF01
Grados Brazo Ajustable Coche Parasol Soporte Celular Univers TQ14;Colecta de Mercado Envíos;MELI Logistics;MEL43281005119FMXDF01
Máquina Recortadora Wmark Ng-202 Transparente 100v/240vColor : Transparente | Voltaje : 100V/240VMTCH-65;Colecta de Mercado Envíos;MELI Logistics;MEL43281141874FMXDF01
Estufa Camping Montaña Parrilla Fogón Gas Portatil + Estuche VT-13;Mercado Envíos Flex;TOR.TECHONOLOGY;43281134626
Teclado Gamer Weibo Wb-580 Qwerty Color Negro Con Luz Rgb huge-ad-42;Colecta de Mercado Envíos;MELI Logistics;MEL43281087684FMXDF01
Rizador Automatico Recargable Portatil NuevoColor : colores | Voltaje : 110VZ-36;Mercado Envíos Flex;TOR.TECHONOLOGY;43281058336
1 Ventilador Doble Auto Coche Portátil Potente 2velocidades TREKA-AD-24;Colecta de Mercado Envíos;MELI Logistics;MEL43281055570FMXDF01
Mini Hielera Flexible Portátil Ice Cube Ahorra Espacio SilicColor : AzulHIELERAICECUBE;Mercado Envíos Flex;TOR.TECHONOLOGY;43281033594
Lampara Farola Solar Sensor De Movimiento ExteriorColor : Colores | Voltaje : 110VIND-S-36;Mercado Envíos Flex;TOR.TECHONOLOGY;43280874961
Sarten Antiadherente 4 Puestos Para Huevos Arepas PancakesColor : NegroRACO-19;Colecta de Mercado Envíos;MELI Logistics;MEL43282072940FMXDF01
Multi Puertos Usb 3.0 7 Puertos Con Interruptor Color Negro HUGE-AD-5;Mercado Envíos Flex;TOR.TECHONOLOGY;43281899225
Candado Con Lector De Huella Recargable Digital Sin LlaveColor : SEGUN DISPONIBILIDADVMX-AD-40;Mercado Envíos Flex;TOR.TECHONOLOGY;43282023392
Fisioterapia Almohadilla Térmica Manta EléctricaColor : GrisTS-50;Mercado Envíos Flex;TOR.TECHONOLOGY;43282018454
Adaptador Hub Tipo C 5 En 1 Ethernet Hdmi Usb 3.0 Pd | Css STCK-45-F;Mercado Envíos Flex;TOR.TECHONOLOGY;43281985650
Silbato Turbo Escape Válvula Sopladora Sonido Coche TRGS-6-F;Mercado Envíos Flex;TOR.TECHONOLOGY;43281869317
Kit Herramienta Limpieza Y Cuidado De Los Oídos En Estuche RD-5;Mercado Envíos Flex;TOR.TECHONOLOGY;43281839723
Llave Universal Manual Multifuncional 48 En 1 Tigre IND-S-14;Colecta de Mercado Envíos;MELI Logistics;MEL43279635272FMXDF01
Tira De Luces Led Rgb Bluetooth Rítmica Adaptador + ControlColor de la luz : RGBTC-14;Mercado Envíos Flex;TOR.TECHONOLOGY;43281824251
Inflador Bomba De Globos Eléctrico 600w + AccesoriosVoltaje : 110VInflador de Globos;Mercado Envíos Flex;TOR.TECHONOLOGY;43281823775
Lampara Led Antorcha Tipo Farol Con Panel Solar Y EstacaColor : NegroLI-25;Mercado Envíos Flex;TOR.TECHONOLOGY;43281928866
Closet Armario Doble Desarmable Con Forro 3 Espacios Negro IMPORHAUSE-AD-70;Colecta de Mercado Envíos;MELI Logistics;MEL43281946836FMXDF01
Calentador De Ambiente Eléctrico DBT-E-23;Colecta de Mercado Envíos;MELI Logistics;MEL43281742429FMXDF01
Canastilla Papel Antiadherente Air Fryer Freidora X 100 Und Papel Antiadherente 100 unidades;Mercado Envíos Flex;TOR.TECHONOLOGY;43281743623
Tapete Antideslizante De Cocina GrandeAncho : 40 cm | Color : SEGUN DISPONIBILIDAD | Diseño de la tela : RECTANGULAR | Largo : 120 cmGLOBALI-AD-30;Colecta de Mercado Envíos;MELI Logistics;MEL43281737809FMXDF01
Reflector Lampara Led Panel Solar 750c 100w RecargableColor de la carcasa : NegroReflector CL-750S;Mercado Envíos Flex;TOR.TECHONOLOGY;43281733609
Panel Solar Cargador Celular 8w 6v Energía Solar Cl-680Color : Negropanel solar cl 680;Colecta de Mercado Envíos;MELI Logistics;MEL43281813208FMXDF01
Reductor Quita Papada FacialColor : COLOR SEGUN DISPONIBILIDAD | Voltaje : 110VVTV-AD-7;Colecta de Mercado Envíos;MELI Logistics;MEL43281848850FMXDF01
Purificar De Agua Mineral Water PurifiedColor : BlancoPurificar De Agua Mineral;Mercado Envíos Flex;TOR.TECHONOLOGY;43281698353
Boquitoquis Radio Telefono Baofeng 888s X4 50km Set Baofen 2 cajas-100;Colecta de Mercado Envíos;MELI Logistics;MEL43281666067FMXDF01
Organizador Frasco Hermetico Cocina Tupper Recipiente Set X7Color : NegroIMPORH-AD-50;Colecta de Mercado Envíos;MELI Logistics;MEL43281640551FMXDF01
Máquina Automática Para Hacer Dumplings, EmpandasColor : GrisTC-25;Mercado Envíos Flex;TOR.TECHONOLOGY;43281783180
Maquina Peluquería Inalámbrica Kemei Km3705 Profesional TC-88;Colecta de Mercado Envíos;MELI Logistics;MEL43281776272FMXDF01
Cinturón Correa Maternidad Ajustable Anti-dolor Espalda BajaColor : NegroTQ-20;Mercado Envíos Flex;TOR.TECHONOLOGY;43281619049
Kit Caja De Herramientas + Caja De Transporte 82 PiezasColor : Negro/NaranjaKIT HERRAMIENTAS 89 PIEZAS;Colecta de Mercado Envíos;MELI Logistics;MEL43281594365FMXDF01
Smartwatch Genérica T500 + Pro Sport Caja De Abs Negra, Malla Negra De Goma Y Bisel De Abs 20-J-TQJ;Colecta de Mercado Envíos;MELI Logistics;MEL43281735176FMXDF01
Set De 100 Bolsas Para Maquina Selladora Al Vacio 25 X 17 CmColor : BlancoRC-M-18;Mercado Envíos Flex;TOR.TECHONOLOGY;43281677426
Rodillo Para Pintar Con Accesorios Completos Paint Roller VMX-M-22;Colecta de Mercado Envíos;MELI Logistics;MEL43281671422FMXDF01
Air Control Remoto Mouse Teclado Inalámbrico Tv Box PortátilColor del mouse : Colores | Color del teclado : COLORESVLZ-S-17;Mercado Envíos Flex;TOR.TECHONOLOGY;43281663942
Lámpara Mata Zancudos Atrapa Moscas Insectos Sin Veneno LAMPARAMATAMOSQUITOSINDEPE;Mercado Envíos Flex;TOR.TECHONOLOGY;43281484661
Manguera Rígida 30 Metros Jardín Riego Lavado Roceo Color Verde VTV-E-50;Mercado Envíos Flex;TOR.TECHONOLOGY;43281618340
Triangulo Carretera Luz Led Emergencia Sos Recargable Solar STCK-18-F;Colecta de Mercado Envíos;MELI Logistics;MEL43281580256FMXDF01
Muñeco Ken Lovely Dog Accesorios Sonidos Mascota Defa Kevin FG-61;Mercado Envíos Flex;TOR.TECHONOLOGY;43281473589
Protector Forro Sofa Mueble 3puestos Cafe Beige Pelo Mascota Color Marrón / Habano Triple QUA-J-28;Colecta de Mercado Envíos;MELI Logistics;MEL43282360055FMXDF01
Manguera Agua Expandible 30 Mts - Unidad a $28900 GT-AD-16;Colecta de Mercado Envíos;MELI Logistics;MEL43282346441FMXDF01
Peluche De Oso Parlante Teddy Bear Con Movimiento Peek A BooColor : Beigesd;Colecta de Mercado Envíos;Envia;MEL43282476128FMXDF01
Mini Parlante Portátil Speaker Disco Bajos Profundos X-911 5v ci-ad-25;Colecta de Mercado Envíos;MELI Logistics;MEL43282321759FMXDF01
Pernera De Compresión Pantorrilla Mujer Hombre 20-30 Mm HgColor : Blanco | Diseño de la tela : Nylon | Talla : UNICAFK-AD-8;Colecta de Mercado Envíos;MELI Logistics;MEL43282469650FMXDF01
Juego Didáctico Tablas De Multiplicar Fácil Y Práctico TABLA MULTIPLICAR;Mercado Envíos Flex;TOR.TECHONOLOGY;43282457048
Panel Solar Celda Portátil Plegable 10w Carga Celular Usb LI-42;Colecta de Mercado Envíos;MELI Logistics;MEL43282454468FMXDF01
Parlante Profesional Torre De Sonido Bt Sonivox Vs-ss2590 Color Negro 110v/220v PRCH-E-300;Colecta de Mercado Envíos;MELI Logistics;MEL43282448924FMXDF01
Limpiador Magnético Doble - Unidad a $15900 Limpiador de vidrios;Mercado Envíos Flex;TOR.TECHONOLOGY;43282302013
Pesa Balanza Inteligente Bluetooth Grasa Peso CorporalColor : Negro | Voltaje : 110bascula digital peso blue;Mercado Envíos Flex;TOR.TECHONOLOGY;43282436868
Masajeador Infrarrojo Delfin Con 3 Puntas Distintas DGZ-S-33;Colecta de Mercado Envíos;MELI Logistics;MEL43282424954FMXDF01
Mini Lavadora De Brochas De MaquillajeColor : RosaGOT-10;Mercado Envíos Flex;TOR.TECHONOLOGY;43282409872
Ejercitador De Dedos Agarre Mano Muñeca Terapias EjerciciosColor : NegroPRMTH-E-5;Colecta de Mercado Envíos;MELI Logistics;MEL43282392828FMXDF01
Flawless DermaplaneColor : Negro | Voltaje : 110VDG-S-10;Colecta de Mercado Envíos;MELI Logistics;MEL43282234059FMXDF01
Mini Batidora Picador Electrico Multifunción Recargable 2en1Color : SEGUN DISPONIBILIDAD | Frecuencia : 50/60 | Voltaje : 110VVMX-AD-24;Colecta de Mercado Envíos;MELI Logistics;MEL43282183549FMXDF01
Cinta Kinesio Tape Neuromuscular Vendaje Deportivo Terapia Color Segun Disponibilidad TC-AD-8;Colecta de Mercado Envíos;MELI Logistics;MEL43282199427FMXDF01
Cortadora De Cabello Profesional Vgr V-002 OriginalColor : Negro | Voltaje : 110VDB-95;Colecta de Mercado Envíos;MELI Logistics;MEL43282307750FMXDF01
Licuadora Portatil Deportiva 380ml Inalambrica Batidos Fruta Color Rosa TQ-15;Colecta de Mercado Envíos;MELI Logistics;MEL43282286204FMXDF01
Manguera Expandible Flexible 30 Metros Con Aspersor Jardin Color Verde GOT-23;Mercado Envíos Flex;TOR.TECHONOLOGY;43282123053
Molde Prensa Manual Para Carne Hamburguesa Cocina Color Gris VT-8;Mercado Envíos Flex;TOR.TECHONOLOGY;43282130097
Soporte Tv Móvil Ruedas 32'' A 70'' Max 50kg Jd Spr-6402 Color Negro LI-M-170;Mercado Envíos Flex;TOR.TECHONOLOGY;43282254282
Manguera Expandible 15 Metros Color Verde + Pistola GAT-13;Colecta de Mercado Envíos;MELI Logistics;MEL43279720661FMXDF01
Camara Espía Hd Wifi Reloj Despertador Color Negro DTNK-77-F;Colecta de Mercado Envíos;MELI Logistics;MEL43282209964FMXDF01
Camara De Seguridad Exterior Domo Ip Wifi 2mp Audio App V380Color : BlancoDTRONK-60-F;Mercado Envíos Flex;TOR.TECHONOLOGY;43282061613
Hervidor De Huevos Gallina Olla Eléctrica Cocinar HuevosColor : Amarillo | Voltaje : 110VTQ-12;Colecta de Mercado Envíos;MELI Logistics;MEL43282204310FMXDF01
Parlante Cabina Bluetooth De 6.5 Pulgadas 5400w P.m.p.o Nia Color Negro 3.7 NI-M-80;Mercado Envíos Flex;TOR.TECHONOLOGY;43281969271
Manguera Flexible Expandible 30 Metro + Acople + Pistola Color Verde Lima GOT-23;Mercado Envíos Flex;TOR.TECHONOLOGY;43284291663
Kit Organizadores De Maleta Bolsas De Viaje X7 PiezasColor : Azul marinoDG-24-J;Colecta de Mercado Envíos;MELI Logistics;MEL43284417376FMXDF01
Cámara De Seguridad V380 Para Exteriores Cámara Seguridad Ip Wifi Blanca DTK-60;Mercado Envíos Flex;TOR.TECHONOLOGY;43284253535
Molino Moledor Eléctrico 2 En 1 Grande Café Especias RD-43-F;Mercado Envíos Flex;TOR.TECHONOLOGY;43284370256
Practica Y Precisa Bascula Para Pesar Equipaje.Color : GrisGOT-16;Mercado Envíos Flex;TOR.TECHONOLOGY;43284146609
Barra Extensora Para Mancuernas Armar Barra Larga 90cm TotalColor : PlateadoBMX-M-11;Mercado Envíos Flex;TOR.TECHONOLOGY;43284107559
Correa Portabebes Cargador Para Bebe CanguroColor : Rosa | Nombre del diseño : RosaJUA-18;Mercado Envíos Flex;TOR.TECHONOLOGY;43283885723
Auriculares De Conducción Aérea Awei A886 Pro Bluetooth 5.3, Color Negro TQ-25-J;Colecta de Mercado Envíos;MELI Logistics;MEL43284024168FMXDF01
Audífonos Conducción Osea Inalámbricos U9 Deportes Al Aire LColor : COLORES | Color de la luz : BlancoTNT-22-J;Colecta de Mercado Envíos;Envia;MEL43279136865FMXDF01
Plancha A Vapor Viajera Ropa, Portátil Travel TobiColor : Blanco | Voltaje : 110VGT-27;Colecta de Mercado Envíos;MELI Logistics;MEL43283994816FMXDF01
Cabezal Ducha Externo Lavamanos Grifo Monomando Filtro Baños Color Plateado VRTV-14-F;Mercado Envíos Flex;TOR.TECHONOLOGY;43283845573
Organizador De Baño Estantería Mueble Ahorrador De Espacio 3Color : BlancoGT-48;Mercado Envíos Flex;TOR.TECHONOLOGY;43283942360
Cámara De Seguridad Shenzhen A9 Mini Con Resolución De 1080p Visión Nocturna Incluida Negra TC-14;Colecta de Mercado Envíos;MELI Logistics;MEL43283777671FMXDF01
Lonchera Porta Comida Electrica Practica Segura + Cuchara Color Blanco 110v/220v TQ-21;Colecta de Mercado Envíos;MELI Logistics;MEL43283908838FMXDF01
Lampara De Lupa Luz Led De Mesa O Escritorio FlexibleColor : Blanco | Voltaje : 12VDTRNK-48-F;Mercado Envíos Flex;TOR.TECHONOLOGY;43283756459
Kit Parlante Y Micrófono Karaoke Para Niños Bluetooth HG-30;Mercado Envíos Flex;TOR.TECHONOLOGY;43283747439
Destapador De Botella Eléctrico Automatico Color Negro EH-E-10;Mercado Envíos Flex;TOR.TECHONOLOGY;43283897938
Teclado Mecánico Con Luces Tecla Ñ Color Del Teclado Negro HG-70;Mercado Envíos Flex;TOR.TECHONOLOGY;43283738423
Mini Proyector Portátil Hd 1500 Lúmenes Usb Celular Mesma Color Fix JUA-95;Colecta de Mercado Envíos;MELI Logistics;MEL43283885942FMXDF01
Masajeador Muscular Inalámbrico Facial Gun Fascial Gun 720Color : Negro | Voltaje : 110VVT-30;Mercado Envíos Flex;TOR.TECHONOLOGY;43283753500
Video Beam Proyector Mini Led Hdmi Yg300 60 Pulgadas TS-78-F;Mercado Envíos Flex;TOR.TECHONOLOGY;43283708989
Cámara Ip Wifi Vilancia 4g Exterior Panel Solar Ip6Color : BlancoDTRNK-180-F;Mercado Envíos Flex;TOR.TECHONOLOGY;43283697315
Aktion Proyector Ultra Portátil Modelo Yg300 Resolución Hd- Amarillo TS-90;Mercado Envíos Flex;TOR.TECHONOLOGY;43283831552
Kit Reflector Led Solar Exterior Panel 300w Lampara ControlColor de la carcasa : NegroHG-110;Colecta de Mercado Envíos;MELI Logistics;MEL43283818250FMXDF01
Molino Eléctrico Para Maíz Carne 2500w 6 En 1 Con Embutidor RD-120;Mercado Envíos Flex;TOR.TECHONOLOGY;43279766049
Mini Afeitadora Mini Shaver Eléctrica Portátil De BolsilloColor : Plateado | Voltaje : 110VRD-9-F;Colecta de Mercado Envíos;MELI Logistics;MEL43283644997FMXDF01
Mesa Laptop Portátil Computador Tablet Cama DesayunoColor : COLORESTVN-35-F;Mercado Envíos Flex;TOR.TECHONOLOGY;43283784578
Afeitadora Eléctrica Portátil Mini-shave Recargable Por UsbColor : Negro | Voltaje : 2453518VVZ-11;Colecta de Mercado Envíos;MELI Logistics;MEL43283758742FMXDF01
Cortadora De Pelo Vgr V-280 Dorada 110v/220v LI-78;Colecta de Mercado Envíos;MELI Logistics;MEL43283754518FMXDF01
Pelota Bola Inteligente Para Gatos Perros Recargable Usb CColor : RosaDG-12;Mercado Envíos Flex;TOR.TECHONOLOGY;43283730936
Cinturón De Carga Y Seguridad Levantamiento De PesoTalla : unicaVZ-18;Colecta de Mercado Envíos;MELI Logistics;MEL43283581077FMXDF01
Set De Ventosas Vacum Terapia M VZ-13;Colecta de Mercado Envíos;MELI Logistics;MEL43283715326FMXDF01
Lampara Recargable Solar Camara Falsa Con Sensor De MovimienColor : BlancoTQ-18;Mercado Envíos Flex;TOR.TECHONOLOGY;43283567389
Reflector Solar Exterior 500w Recargable Panel Led Luz BlancColor de la carcasa : Negro | Color de la luz : Blanco frío | Voltaje : 110VVT-150;Colecta de Mercado Envíos;MELI Logistics;MEL43283245106FMXDF01
Molino Moledor De Café Y Pequeñas Especias EléctricoColor : GrisRD-22;Mercado Envíos Flex;TOR.TECHONOLOGY;43283691284
Revoflex Xtreme Doble Rueda Para Abdominales + Bolso VMX-M-19;Mercado Envíos Flex;TOR.TECHONOLOGY;43283694790
Toallitas Paños Humedos Limpieza Zapatos Calzado Tenis X30Color : NegroMIMI-10;Colecta de Mercado Envíos;MELI Logistics;MEL43283668720FMXDF01
Iniciador De Batería Para Auto M33 TM-135-J;Mercado Envíos Flex;TOR.TECHONOLOGY;43283506703
Maquina Mini Waflera En Palitos Antiadherente 420wColor : Rojo | Voltaje : 110VSOVO-M-38;Colecta de Mercado Envíos;MELI Logistics;MEL43283629196FMXDF01
Sistema De Sonido 2.1 Wit Pw-2000 | Compatibilidad CompletaColor : NegroDRMTCH-27-F;Colecta de Mercado Envíos;MELI Logistics;MEL43283458951FMXDF01
Correa Portabebes Cargador Para Bebe CanguroColor : Gris | Nombre del diseño : GrisJUA-18;Colecta de Mercado Envíos;MELI Logistics;MEL43283382985FMXDF01
Cortadora De Cabello Vgr-002 Original 9000rpm + Envio GratisColor : Negro | Voltaje : 110VWHA-M-106;Mercado Envíos Flex;TOR.TECHONOLOGY;43283523786
Micrófono Shure Sv Sv200 Dinámico Cardioide Color Negro EH-45-J;Colecta de Mercado Envíos;MELI Logistics;MEL43283517204FMXDF01
Kit Bandas Elasticas Cerradas X5 + Guía De Ejercicio + BolsoColor : TQ-7TC-4.5-J;Mercado Envíos Flex;TOR.TECHONOLOGY;43283347467
Molino Eléctrico Picador De Carne Procesador RenahouseColor : Gris | Voltaje : 110VRNH-M-450;Colecta de Mercado Envíos;MELI Logistics;MEL43283291833FMXDF01
Máquina De Coser Eléctrica Compacta Para El Hogar Con Luz Nocturna Portátil, Pedal De Pie Y Mesa De Mano Para Costura Recta. Incluye Kit De Dos Puntadas 7896502859689;Mercado Envíos Flex;TOR.TECHONOLOGY;43283284665
Gafas Mágicas Visión 3 En 1 AntideslumbranteColor de la lente : Negro | Color del armazón : Negro | Talla : unicaNR-15;Mercado Envíos Flex;TOR.TECHONOLOGY;43283206619
Telefono Panasonic Fijo De Mesa Alambrico Ts500- 7700Color : BlancoZKSO-26-F;Mercado Envíos Flex;TOR.TECHONOLOGY;43283172057
Micrófono Shure Sv100 Dinámico Cardioide Color Negro/plateado EH-45-J;Colecta de Mercado Envíos;MELI Logistics;MEL43283301994FMXDF01
Maquina Para Mini Donas Rosquillas Antiadherente ElectricaColor : Rojo | Voltaje : 110VSOVO-M-22;Colecta de Mercado Envíos;MELI Logistics;MEL43283290686FMXDF01
Olla De 13 Litros Acero Inoxidable Universal RoyalColor : PlateadoELECTPRM-100-F;Mercado Envíos Flex;TOR.TECHONOLOGY;43282661755
Marcadores Tommax Set 120 U Multi VLZ-M-37;Colecta de Mercado Envíos;MELI Logistics;MEL43283095539FMXDF01
Soporte Tv Móvil Ruedas 32'' A 70'' Max 50kg Jd Spr-6402 Color Negro;Colecta de Mercado Envíos;MELI Logistics;MEL43283085045FMXDF01
Ventilador Recargable Pestañas - Unidad a $29900 ZOO-M-17;Mercado Envíos Flex;TOR.TECHONOLOGY;43283070819
Computador De Juguete Didactico Y Educativo Para Niña Rosa HG-50;Colecta de Mercado Envíos;MELI Logistics;MEL43281761653FMXDF01
Mini Atomizador Perfume Portátil Spray Recargable Practico TVN-5-F;Colecta de Mercado Envíos;Coordinadora;MEL43283039151FMXDF01
Molino De Carne Electrico 280w Con Accion De Reversa DB-145;Mercado Envíos Flex;TOR.TECHONOLOGY;43283019193
Base Gamer Refrigerante De Portátil 5 Niveles 2ventiladoresColor : NegroDRMTCH-E-33;Mercado Envíos Flex;TOR.TECHONOLOGY;43282986473
Combo Gamer Para Celular/tablet Teclado Mouse ConvertidorColor del teclado : NegroHG-75;Mercado Envíos Flex;TOR.TECHONOLOGY;43283137962
Manguera Expandible Flexible 30 Metros Con Aspersor Jardin CColor : VerdeGOT-23;Mercado Envíos Flex;TOR.TECHONOLOGY;43282977825
Tablet Medium 7 Pulgadas Memoria Ram 2g + Rom 32g SimcardColor : NegroDRMTCH-225-F;Mercado Envíos Flex;TOR.TECHONOLOGY;43283075774
Lámpara Mata Insectos Antimosquitos Y Trampa Zancudos UsbColor : BlancoJUA-8;Colecta de Mercado Envíos;MELI Logistics;MEL43283046356FMXDF01
Panel Solar Reflector Led 200w Solar Luz BlancaColor de la carcasa : Negro | Color de la luz : Blanco frío | Voltaje : 110VPARLACH-70;Colecta de Mercado Envíos;MELI Logistics;MEL43282891959FMXDF01
Olla De Vidrio De Borosilicato Con Tapa 1.5 LitrosColor : VidrioRC-35;Mercado Envíos Flex;TOR.TECHONOLOGY;43283036730
Set X8 Bolsas Malla Fina Para Lavar Ropa Delicada, LavadoraColor : BlancoMV-30;Mercado Envíos Flex;TOR.TECHONOLOGY;43282885909
Juego De Recipientes Herméticos Para Alimentos 7 Unidades EH-M-55;Colecta de Mercado Envíos;MELI Logistics;MEL43282852527FMXDF01
Enjuague Bucal Eléctrico;Colecta de Mercado Envíos;MELI Logistics;MEL43282850937FMXDF01
Soporte Tv Móvil Ruedas 32'' A 70'' Max 50kg Jd Spr-6402 Color Negro NIA-160;Colecta de Mercado Envíos;MELI Logistics;MEL43282842177FMXDF01
Cesto Triple Plegable Para Sucia VT-35;Colecta de Mercado Envíos;MELI Logistics;MEL43277527817FMXDF01
Ducha Portátil Tipo Caracol Flexible Para NiñosColor : VerdeBG-60;Mercado Envíos Flex;TOR.TECHONOLOGY;43282812577
Jarra Hervidora De Agua Tetera Eléctrica Calentador 2 Litros Color Plateado 1v ELECTPRM-35-F;Colecta de Mercado Envíos;Envia;MEL43282759217FMXDF01
Estufa De Inducción Digital Universal Royal De 2 PuestosColor : NegroELECTPRM-380-F;Colecta de Mercado Envíos;MELI Logistics;MEL43282774017FMXDF01
Afeitadora Barbera Militar Kemei Tx7 Inalámbrica Pantalla Color Verde 110v/240v DB-66;Colecta de Mercado Envíos;MELI Logistics;MEL43282698917FMXDF01
Bebedero Termo Mascotas Portátil Fácil Llevar Perros GatosColor : ColoresVRTV-15-F;Colecta de Mercado Envíos;MELI Logistics;MEL43282670373FMXDF01
Manguera Retractil Expandible Mágica 45 Mts. + Pitón | Dugu Color Verde ZM-27-J;Colecta de Mercado Envíos;MELI Logistics;MEL43282492412FMXDF01
Audifonos Diadema Niños Bluetooth Recargable Con Muñeco GatoColor : Rosa | Color de la luz : NA;Colecta de Mercado Envíos;MELI Logistics;MEL43282593985FMXDF01
Waflera Eléctrica Doble De Figuras Antiadherente Sokany 1100Color : Negro | Voltaje : 1100DR-J-75;Colecta de Mercado Envíos;MELI Logistics;MEL43282386611FMXDF01
Lampara Reflector Doble Panel Energía Solar 300w Cl115Color de la carcasa : Negro | Color de la luz : Blanco frío | Voltaje : 110VDB-62;Colecta de Mercado Envíos;MELI Logistics;MEL43282655582FMXDF01
Microfono Condensador Profesional Rgb Usb Gaming GrabacionesColor : NegroHG-80;Mercado Envíos Flex;TOR.TECHONOLOGY;43282455653
Inflador De Globos Electrico 600 Watts Doble BoquillaVoltaje : 110VRC-M-30;Mercado Envíos Flex;TOR.TECHONOLOGY;43282594090
Tabla Para Doblar Ropa Para AdultosColor : coloresMV-25;Colecta de Mercado Envíos;MELI Logistics;MEL43281270495FMXDF01
Ducha Portátil Tipo Caracol Flexible Para NiñosColor : RosaBG-60;Colecta de Mercado Envíos;MELI Logistics;MEL43278773797FMXDF01
"Ventilador Home Elements 3 En 1, Piso, Mesa Y Pared 16Cantidad de aspas : 3 | Color de la estructura : Negro | Diámetro : 16 ""ELECTPRM-110-F";Mercado Envíos Flex;TOR.TECHONOLOGY;43276797965
Juego De Vajilla De Dinosaurio De 5 Piezas Para Niños, PlatoColor : Blanco | Nombre del diseño : DinosaurioVT-M-22;Mercado Envíos Flex;TOR.TECHONOLOGY;43284943915
Correa Portabebes Cargador Para Bebe CanguroColor : Verde | Nombre del diseño : VerdeJUA-18;Mercado Envíos Flex;TOR.TECHONOLOGY;43285088648
Aire Acondicionado Portatil Refrigerador Personal Artic AirColor : Blanco | Voltaje : 110V | Voltaje de la unidad externa : 110RC-M-26;Colecta de Mercado Envíos;MELI Logistics;MEL43282510745FMXDF01
Soporte Para Tv Pedestal Móvil Con Ruedas Para Tv 32 A 70'' Color Negro NIA-160;Colecta de Mercado Envíos;MELI Logistics;MEL43284903449FMXDF01
Kit Mancuernas Pesas 20 Kg Juego De Mancuernas CromadasColor : PlateadoIF-180;Colecta de Mercado Envíos;MELI Logistics;MEL43284869521FMXDF01
Maquina Cortadora Wmark Profesional Ng-9003Color : Colores | Voltaje : 110VSOVO-M-145;Mercado Envíos Flex;TOR.TECHONOLOGY;43284994298
Barra Extensora Para Mancuernas Armar Barra Larga 90cm Total Color Plateado BMX-M-11;Colecta de Mercado Envíos;MELI Logistics;MEL43284968672FMXDF01
Reductor Quita Papada Facial Masajeador Led Vibración CuelloColor : Blanco | Voltaje : 110VVZ-39;Colecta de Mercado Envíos;Envia;MEL43284890466FMXDF01
Computador Portatil Didactico Maquina De Estudio Niño Y NiñaColor : AzulCI-M-25;Colecta de Mercado Envíos;MELI Logistics;MEL43284944072FMXDF01
Plancha Alisadora Remington Shine Therapy Aguacate PRHM-50-J;Colecta de Mercado Envíos;MELI Logistics;MEL43284892798FMXDF01
Tonificador Facial Ejercitador Ejercicio Mandibular MandibulColor : AzulBG-35-F;Colecta de Mercado Envíos;MELI Logistics;MEL43284881778FMXDF01
Cámara Espia Boligrafo Esfero Con Cámara Full Hd 1080pColor : NegroCM-25-J;Colecta de Mercado Envíos;MELI Logistics;MEL43284728509FMXDF01
Audifonos Inalambricos Bluetooth Gamer Deportivos M25 Tws 9d Color Negro 7908340665039;Mercado Envíos Flex;TOR.TECHONOLOGY;43284706503
Mesa Laptop Portátil Computador Tablet Cama DesayunoColor : RosaVT-35;Mercado Envíos Flex;TOR.TECHONOLOGY;43284703458
Paint Roller Rodillo Recargable Para Pintar Facil Y Limpio ZM-27-J;Mercado Envíos Flex;TOR.TECHONOLOGY;43284822044
Manguera Reforzada Para Riego Extensible 15 Mts 50 Ft Regar Color Azul ZM-12-J;Mercado Envíos Flex;TOR.TECHONOLOGY;43284800396
Mini Licuadora Vaso Portatil Procesadora Recargable Usb Color Verde 20-J-BG;Colecta de Mercado Envíos;MELI Logistics;MEL43284725812FMXDF01
Crioterapia Adios Migrañaalivio - g a $369 VZ-17;Colecta de Mercado Envíos;MELI Logistics;MEL43284536937FMXDF01
Bolso Carriel Antirrobo Canguro Deportiva Kanguro PecheraColor : Negro | Diseño de la tela : LisoVZ-44;Colecta de Mercado Envíos;MELI Logistics;MEL43284678830FMXDF01
Masajeador Electrico Con Infrarojo 3 CabezalesColor : Rojo | Voltaje : 110VPARCH-M-48;Colecta de Mercado Envíos;Envia;MEL43284272687FMXDF01
Nebulizador Portatil Recargable Adulto Y Pediatrico Color Blanco VZ-47;Colecta de Mercado Envíos;MELI Logistics;MEL43284663762FMXDF01
Lampara Reflector Doble Panel Energía Solar 300w Cl115 Carcasa Negro Luz Blanco Frío 110v DB-62;Mercado Envíos Flex;TOR.TECHONOLOGY;43284503193
