Nombre_producto;Forma_entrega;Transportadora;Numero_seguimiento
Camara Espía Hd Wifi Reloj Despertador Color Negro DTNK-77-F;Colecta de Mercado Envíos;MELI Logistics;MEL43247602635FMXDF01
Camara De Seguridad Exterior Domo Ip Wifi 2mp Audio App V380Color : BlancoDTRONK-60-F;Colecta de Mercado Envíos;MELI Logistics;MEL43247591629FMXDF01
Hervidor De Huevos Gallina Olla Eléctrica Cocinar HuevosColor : Amarillo | Voltaje : 110VTQ-12;Colecta de Mercado Envíos;MELI Logistics;MEL43247571567FMXDF01
Parlante Cabina Bluetooth De 6.5 Pulgadas 5400w P.m.p.o Nia Color Negro 3.7 NI-M-80;Mercado Envíos Flex;TOR.TECHONOLOGY;43247553571
Manguera Flexible Expandible 30 Metro + Acople + Pistola Color Verde Lima GOT-23;Colecta de Mercado Envíos;MELI Logistics;MEL43247533879FMXDF01
Kit Organizadores De Maleta Bolsas De Viaje X7 PiezasColor : Azul marinoDG-24-J;Colecta de Mercado Envíos;MELI Logistics;MEL43247672630FMXDF01
Cámara De Seguridad V380 Para Exteriores Cámara Seguridad Ip Wifi Blanca DTK-60;Mercado Envíos Flex;TOR.TECHONOLOGY;43247630214
Molino Moledor Eléctrico 2 En 1 Grande Café Especias RD-43-F;Colecta de Mercado Envíos;MELI Logistics;MEL43210915251FMXDF01
Practica Y Precisa Bascula Para Pesar Equipaje.Color : GrisGOT-16;Mercado Envíos Flex;TOR.TECHONOLOGY;43247409943
Barra Extensora Para Mancuernas Armar Barra Larga 90cm TotalColor : PlateadoBMX-M-11;Mercado Envíos Flex;TOR.TECHONOLOGY;43247410267
Correa Portabebes Cargador Para Bebe CanguroColor : Rosa | Nombre del diseño : RosaJUA-18;Mercado Envíos Flex;TOR.TECHONOLOGY;43247409959
Auriculares De Conducción Aérea Awei A886 Pro Bluetooth 5.3, Color Negro TQ-25-J;Colecta de Mercado Envíos;Envia;MEL43246572399FMXDF01
Audífonos Conducción Osea Inalámbricos U9 Deportes Al Aire LColor : COLORES | Color de la luz : BlancoTNT-22-J;Colecta de Mercado Envíos;MELI Logistics;MEL43247353637FMXDF01
Plancha A Vapor Viajera Ropa, Portátil Travel TobiColor : Blanco | Voltaje : 110VGT-27;Mercado Envíos Flex;TOR.TECHONOLOGY;43242923831
Cabezal Ducha Externo Lavamanos Grifo Monomando Filtro Baños Color Plateado VRTV-14-F;Colecta de Mercado Envíos;MELI Logistics;MEL43247341403FMXDF01
Organizador De Baño Estantería Mueble Ahorrador De Espacio 3Color : BlancoGT-48;Colecta de Mercado Envíos;MELI Logistics;MEL43247442040FMXDF01
Cámara De Seguridad Shenzhen A9 Mini Con Resolución De 1080p Visión Nocturna Incluida Negra TC-14;Colecta de Mercado Envíos;MELI Logistics;MEL43247397524FMXDF01
Lonchera Porta Comida Electrica Practica Segura + Cuchara Color Blanco 110v/220v TQ-21;Colecta de Mercado Envíos;MELI Logistics;MEL43247402736FMXDF01
Lampara De Lupa Luz Led De Mesa O Escritorio FlexibleColor : Blanco | Voltaje : 12VDTRNK-48-F;Colecta de Mercado Envíos;MELI Logistics;MEL43248082023FMXDF01
Kit Parlante Y Micrófono Karaoke Para Niños Bluetooth HG-30;Colecta de Mercado Envíos;MELI Logistics;MEL43248189892FMXDF01
Destapador De Botella Eléctrico Automatico Color Negro EH-E-10;Mercado Envíos Flex;TOR.TECHONOLOGY;43248034999
Teclado Mecánico Con Luces Tecla Ñ Color Del Teclado Negro HG-70;Colecta de Mercado Envíos;MELI Logistics;MEL43248036939FMXDF01
Mini Proyector Portátil Hd 1500 Lúmenes Usb Celular Mesma Color Fix JUA-95;Colecta de Mercado Envíos;MELI Logistics;MEL43248180086FMXDF01
Masajeador Muscular Inalámbrico Facial Gun Fascial Gun 720Color : Negro | Voltaje : 110VVT-30;Mercado Envíos Flex;TOR.TECHONOLOGY;43248031177
Video Beam Proyector Mini Led Hdmi Yg300 60 Pulgadas TS-78-F;Colecta de Mercado Envíos;MELI Logistics;MEL43248130184FMXDF01
Cámara Ip Wifi Vilancia 4g Exterior Panel Solar Ip6Color : BlancoDTRNK-180-F;Colecta de Mercado Envíos;MELI Logistics;MEL43248028816FMXDF01
Aktion Proyector Ultra Portátil Modelo Yg300 Resolución Hd- Amarillo TS-90;Colecta de Mercado Envíos;MELI Logistics;MEL43248012258FMXDF01
Kit Reflector Led Solar Exterior Panel 300w Lampara ControlColor de la carcasa : NegroHG-110;Colecta de Mercado Envíos;MELI Logistics;MEL43247788187FMXDF01
Molino Eléctrico Para Maíz Carne 2500w 6 En 1 Con Embutidor RD-120;Colecta de Mercado Envíos;MELI Logistics;MEL43247895872FMXDF01
Mini Afeitadora Mini Shaver Eléctrica Portátil De BolsilloColor : Plateado | Voltaje : 110VRD-9-F;Colecta de Mercado Envíos;MELI Logistics;MEL43247186163FMXDF01
Mesa Laptop Portátil Computador Tablet Cama DesayunoColor : COLORESTVN-35-F;Mercado Envíos Flex;TOR.TECHONOLOGY;43247709935
Afeitadora Eléctrica Portátil Mini-shave Recargable Por UsbColor : Negro | Voltaje : 2453518VVZ-11;Mercado Envíos Flex;TOR.TECHONOLOGY;43247717615
Cortadora De Pelo Vgr V-280 Dorada 110v/220v LI-78;Mercado Envíos Flex;TOR.TECHONOLOGY;43247855668
Pelota Bola Inteligente Para Gatos Perros Recargable Usb CColor : RosaDG-12;Colecta de Mercado Envíos;MELI Logistics;MEL43247721120FMXDF01
Cinturón De Carga Y Seguridad Levantamiento De PesoTalla : unicaVZ-18;Mercado Envíos Flex;TOR.TECHONOLOGY;43250717722
Set De Ventosas Vacum Terapia M VZ-13;Colecta de Mercado Envíos;MELI Logistics;MEL43250593202FMXDF01
Lampara Recargable Solar Camara Falsa Con Sensor De MovimienColor : BlancoTQ-18;Colecta de Mercado Envíos;MELI Logistics;MEL43250441609FMXDF01
Reflector Solar Exterior 500w Recargable Panel Led Luz BlancColor de la carcasa : Negro | Color de la luz : Blanco frío | Voltaje : 110VVT-150;Colecta de Mercado Envíos;MELI Logistics;MEL43250411757FMXDF01
Molino Moledor De Café Y Pequeñas Especias EléctricoColor : GrisRD-22;Colecta de Mercado Envíos;MELI Logistics;MEL43250431390FMXDF01
Revoflex Xtreme Doble Rueda Para Abdominales + Bolso VMX-M-19;Colecta de Mercado Envíos;MELI Logistics;MEL43250377812FMXDF01
Toallitas Paños Humedos Limpieza Zapatos Calzado Tenis X30Color : NegroMIMI-10;Colecta de Mercado Envíos;MELI Logistics;MEL43250399022FMXDF01
Iniciador De Batería Para Auto M33 TM-135-J;Colecta de Mercado Envíos;MELI Logistics;MEL43250252020FMXDF01
Maquina Mini Waflera En Palitos Antiadherente 420wColor : Rojo | Voltaje : 110VSOVO-M-38;Colecta de Mercado Envíos;MELI Logistics;MEL43250197750FMXDF01
Sistema De Sonido 2.1 Wit Pw-2000 | Compatibilidad CompletaColor : NegroDRMTCH-27-F;Colecta de Mercado Envíos;MELI Logistics;MEL43250033641FMXDF01
Correa Portabebes Cargador Para Bebe CanguroColor : Gris | Nombre del diseño : GrisJUA-18;Mercado Envíos Flex;TOR.TECHONOLOGY;43250174124
Cortadora De Cabello Vgr-002 Original 9000rpm + Envio GratisColor : Negro | Voltaje : 110VWHA-M-106;Colecta de Mercado Envíos;MELI Logistics;MEL43250130636FMXDF01
Micrófono Shure Sv Sv200 Dinámico Cardioide Color Negro EH-45-J;Mercado Envíos Flex;TOR.TECHONOLOGY;43250083912
Kit Bandas Elasticas Cerradas X5 + Guía De Ejercicio + BolsoColor : TQ-7TC-4.5-J;Mercado Envíos Flex;TOR.TECHONOLOGY;43250059890
Molino Eléctrico Picador De Carne Procesador RenahouseColor : Gris | Voltaje : 110VRNH-M-450;Mercado Envíos Flex;TOR.TECHONOLOGY;43250054926
Máquina De Coser Eléctrica Compacta Para El Hogar Con Luz Nocturna Portátil, Pedal De Pie Y Mesa De Mano Para Costura Recta. Incluye Kit De Dos Puntadas 7896502859689;Colecta de Mercado Envíos;MELI Logistics;MEL43249845533FMXDF01
Gafas Mágicas Visión 3 En 1 AntideslumbranteColor de la lente : Negro | Color del armazón : Negro | Talla : unicaNR-15;Colecta de Mercado Envíos;MELI Logistics;MEL43249994488FMXDF01
Telefono Panasonic Fijo De Mesa Alambrico Ts500- 7700Color : BlancoZKSO-26-F;Mercado Envíos Flex;TOR.TECHONOLOGY;43249814383
Micrófono Shure Sv100 Dinámico Cardioide Color Negro/plateado EH-45-J;Mercado Envíos Flex;TOR.TECHONOLOGY;43249950800
Maquina Para Mini Donas Rosquillas Antiadherente ElectricaColor : Rojo | Voltaje : 110VSOVO-M-22;Colecta de Mercado Envíos;MELI Logistics;MEL43249950698FMXDF01
Olla De 13 Litros Acero Inoxidable Universal RoyalColor : PlateadoELECTPRM-100-F;Mercado Envíos Flex;TOR.TECHONOLOGY;43249908022
Marcadores Tommax Set 120 U Multi VLZ-M-37;Mercado Envíos Flex;TOR.TECHONOLOGY;43249758117
Soporte Tv Móvil Ruedas 32'' A 70'' Max 50kg Jd Spr-6402 Color Negro;Mercado Envíos Flex;TOR.TECHONOLOGY;43249748149
Ventilador Recargable Pestañas - Unidad a $29900 ZOO-M-17;Mercado Envíos Flex;TOR.TECHONOLOGY;43249867136
Computador De Juguete Didactico Y Educativo Para Niña Rosa HG-50;Mercado Envíos Flex;TOR.TECHONOLOGY;43249698183
Mini Atomizador Perfume Portátil Spray Recargable Practico TVN-5-F;Colecta de Mercado Envíos;MELI Logistics;MEL43249774012FMXDF01
Molino De Carne Electrico 280w Con Accion De Reversa DB-145;Mercado Envíos Flex;TOR.TECHONOLOGY;43249559095
Base Gamer Refrigerante De Portátil 5 Niveles 2ventiladoresColor : NegroDRMTCH-E-33;Colecta de Mercado Envíos;MELI Logistics;MEL43249566473FMXDF01
Combo Gamer Para Celular/tablet Teclado Mouse ConvertidorColor del teclado : NegroHG-75;Mercado Envíos Flex;TOR.TECHONOLOGY;43249561245
Manguera Expandible Flexible 30 Metros Con Aspersor Jardin CColor : VerdeGOT-23;Colecta de Mercado Envíos;MELI Logistics;MEL43249663680FMXDF01
Tablet Medium 7 Pulgadas Memoria Ram 2g + Rom 32g SimcardColor : NegroDRMTCH-225-F;Colecta de Mercado Envíos;MELI Logistics;MEL43249502187FMXDF01
Lámpara Mata Insectos Antimosquitos Y Trampa Zancudos UsbColor : BlancoJUA-8;Mercado Envíos Flex;TOR.TECHONOLOGY;43249575230
Panel Solar Reflector Led 200w Solar Luz BlancaColor de la carcasa : Negro | Color de la luz : Blanco frío | Voltaje : 110VPARLACH-70;Colecta de Mercado Envíos;MELI Logistics;MEL43249570866FMXDF01
Olla De Vidrio De Borosilicato Con Tapa 1.5 LitrosColor : VidrioRC-35;Mercado Envíos Flex;TOR.TECHONOLOGY;43249416011
Set X8 Bolsas Malla Fina Para Lavar Ropa Delicada, LavadoraColor : BlancoMV-30;Colecta de Mercado Envíos;MELI Logistics;MEL43249349321FMXDF01
Juego De Recipientes Herméticos Para Alimentos 7 Unidades EH-M-55;Mercado Envíos Flex;TOR.TECHONOLOGY;43249500934
Enjuague Bucal Eléctrico;Colecta de Mercado Envíos;MELI Logistics;MEL43248554005FMXDF01
Soporte Tv Móvil Ruedas 32'' A 70'' Max 50kg Jd Spr-6402 Color Negro NIA-160;Colecta de Mercado Envíos;Envia;MEL43246203093FMXDF01
Cesto Triple Plegable Para Sucia VT-35;Colecta de Mercado Envíos;MELI Logistics;MEL43249187215FMXDF01
Ducha Portátil Tipo Caracol Flexible Para NiñosColor : VerdeBG-60;Mercado Envíos Flex;TOR.TECHONOLOGY;43249098223
Jarra Hervidora De Agua Tetera Eléctrica Calentador 2 Litros Color Plateado 1v ELECTPRM-35-F;Colecta de Mercado Envíos;MELI Logistics;MEL43249064065FMXDF01
Estufa De Inducción Digital Universal Royal De 2 PuestosColor : NegroELECTPRM-380-F;Mercado Envíos Flex;TOR.TECHONOLOGY;43249199552
Afeitadora Barbera Militar Kemei Tx7 Inalámbrica Pantalla Color Verde 110v/240v DB-66;Mercado Envíos Flex;TOR.TECHONOLOGY;43249189704
Bebedero Termo Mascotas Portátil Fácil Llevar Perros GatosColor : ColoresVRTV-15-F;Mercado Envíos Flex;TOR.TECHONOLOGY;43249122570
Manguera Retractil Expandible Mágica 45 Mts. + Pitón | Dugu Color Verde ZM-27-J;Colecta de Mercado Envíos;MELI Logistics;MEL43248974171FMXDF01
Audifonos Diadema Niños Bluetooth Recargable Con Muñeco GatoColor : Rosa | Color de la luz : NA;Colecta de Mercado Envíos;Envia;MEL43247100979FMXDF01
Waflera Eléctrica Doble De Figuras Antiadherente Sokany 1100Color : Negro | Voltaje : 1100DR-J-75;Colecta de Mercado Envíos;Envia;MEL43248934413FMXDF01
Lampara Reflector Doble Panel Energía Solar 300w Cl115Color de la carcasa : Negro | Color de la luz : Blanco frío | Voltaje : 110VDB-62;Colecta de Mercado Envíos;MELI Logistics;MEL43248869973FMXDF01
Microfono Condensador Profesional Rgb Usb Gaming GrabacionesColor : NegroHG-80;Colecta de Mercado Envíos;Envia;MEL43248864725FMXDF01
Inflador De Globos Electrico 600 Watts Doble BoquillaVoltaje : 110VRC-M-30;Mercado Envíos Flex;TOR.TECHONOLOGY;43248989818
Tabla Para Doblar Ropa Para AdultosColor : coloresMV-25;Mercado Envíos Flex;TOR.TECHONOLOGY;43248842211
Ducha Portátil Tipo Caracol Flexible Para NiñosColor : RosaBG-60;Mercado Envíos Flex;TOR.TECHONOLOGY;43248798255
"Ventilador Home Elements 3 En 1, Piso, Mesa Y Pared 16Cantidad de aspas : 3 | Color de la estructura : Negro | Diámetro : 16 ""ELECTPRM-110-F";Colecta de Mercado Envíos;MELI Logistics;MEL43248415951FMXDF01
Juego De Vajilla De Dinosaurio De 5 Piezas Para Niños, PlatoColor : Blanco | Nombre del diseño : DinosaurioVT-M-22;Colecta de Mercado Envíos;MELI Logistics;MEL43248698537FMXDF01
Correa Portabebes Cargador Para Bebe CanguroColor : Verde | Nombre del diseño : VerdeJUA-18;Colecta de Mercado Envíos;MELI Logistics;MEL43248753300FMXDF01
Aire Acondicionado Portatil Refrigerador Personal Artic AirColor : Blanco | Voltaje : 110V | Voltaje de la unidad externa : 110RC-M-26;Colecta de Mercado Envíos;MELI Logistics;MEL43248667420FMXDF01
Soporte Para Tv Pedestal Móvil Con Ruedas Para Tv 32 A 70'' Color Negro NIA-160;Mercado Envíos Flex;TOR.TECHONOLOGY;43251226928
Kit Mancuernas Pesas 20 Kg Juego De Mancuernas CromadasColor : PlateadoIF-180;Colecta de Mercado Envíos;MELI Logistics;MEL43250995699FMXDF01
Maquina Cortadora Wmark Profesional Ng-9003Color : Colores | Voltaje : 110VSOVO-M-145;Colecta de Mercado Envíos;MELI Logistics;MEL43250962433FMXDF01
Barra Extensora Para Mancuernas Armar Barra Larga 90cm Total Color Plateado BMX-M-11;Colecta de Mercado Envíos;MELI Logistics;MEL43250960929FMXDF01
Reductor Quita Papada Facial Masajeador Led Vibración CuelloColor : Blanco | Voltaje : 110VVZ-39;Colecta de Mercado Envíos;MELI Logistics;MEL43251048242FMXDF01
Computador Portatil Didactico Maquina De Estudio Niño Y NiñaColor : AzulCI-M-25;Colecta de Mercado Envíos;MELI Logistics;MEL43251041928FMXDF01
Plancha Alisadora Remington Shine Therapy Aguacate PRHM-50-J;Mercado Envíos Flex;TOR.TECHONOLOGY;43251012904
Tonificador Facial Ejercitador Ejercicio Mandibular MandibulColor : AzulBG-35-F;Colecta de Mercado Envíos;MELI Logistics;MEL43250995960FMXDF01
Cámara Espia Boligrafo Esfero Con Cámara Full Hd 1080pColor : NegroCM-25-J;Mercado Envíos Flex;TOR.TECHONOLOGY;43250832459
Audifonos Inalambricos Bluetooth Gamer Deportivos M25 Tws 9d Color Negro 7908340665039;Colecta de Mercado Envíos;MELI Logistics;MEL43250927724FMXDF01
Mesa Laptop Portátil Computador Tablet Cama DesayunoColor : RosaVT-35;Colecta de Mercado Envíos;MELI Logistics;MEL43250903476FMXDF01
Paint Roller Rodillo Recargable Para Pintar Facil Y Limpio ZM-27-J;Colecta de Mercado Envíos;MELI Logistics;MEL43250732053FMXDF01
Manguera Reforzada Para Riego Extensible 15 Mts 50 Ft Regar Color Azul ZM-12-J;Mercado Envíos Flex;TOR.TECHONOLOGY;43250855832
Mini Licuadora Vaso Portatil Procesadora Recargable Usb Color Verde 20-J-BG;Colecta de Mercado Envíos;MELI Logistics;MEL43250832960FMXDF01
Crioterapia Adios Migrañaalivio - g a $369 VZ-17;Colecta de Mercado Envíos;MELI Logistics;MEL43209673348FMXDF01
Bolso Carriel Antirrobo Canguro Deportiva Kanguro PecheraColor : Negro | Diseño de la tela : LisoVZ-44;Colecta de Mercado Envíos;MELI Logistics;MEL43251605268FMXDF01
Masajeador Electrico Con Infrarojo 3 CabezalesColor : Rojo | Voltaje : 110VPARCH-M-48;Mercado Envíos Flex;TOR.TECHONOLOGY;43251601052
Nebulizador Portatil Recargable Adulto Y Pediatrico Color Blanco VZ-47;Mercado Envíos Flex;TOR.TECHONOLOGY;43251589106
Lampara Reflector Doble Panel Energía Solar 300w Cl115 Carcasa Negro Luz Blanco Frío 110v DB-62;Colecta de Mercado Envíos;MELI Logistics;MEL43248285459FMXDF01
Cojín Silicona Gel Flexible Comodidad + Funda Protectora VZ-19;Colecta de Mercado Envíos;MELI Logistics;MEL43251560998FMXDF01
Removedor Calculos Dental UltrasonicoVoltaje : 110DG-S-28;Mercado Envíos Flex;TOR.TECHONOLOGY;43251510506
Secador De Cabello Keratin Protect 3000w 2003Color : Negro | Voltaje : 110V/220VVMX-AD-18;Mercado Envíos Flex;TOR.TECHONOLOGY;43248765328
Lampara De Escritorio Recargable Decorativa Rgb TouchcontrolColor de la estructura : Colores | Color de la pantalla : Colores | Voltaje : 110VIND-S-18;Mercado Envíos Flex;TOR.TECHONOLOGY;43251308635
Licuadora Osterizer® Max Con Vaso De Vidrio De 1,75 L BlstpbColor : Gris | Voltaje : 110VOS-E-600;Colecta de Mercado Envíos;MELI Logistics;MEL43251380042FMXDF01
Manguera Agua Expandible 15 Mts - Unidad a $22900 VMX-AD-12;Colecta de Mercado Envíos;MELI Logistics;MEL43251162281FMXDF01
Cepillo Dental Limpiador De Sarro Calculo Dental ElectrónicoVoltaje : 127VVG-AD-23;Colecta de Mercado Envíos;MELI Logistics;MEL43251968855FMXDF01
Tendedero De Piso Estante Plegable 2 Niveles Secado Ropa MaxColor : ColoresIMH-S-28;Colecta de Mercado Envíos;MELI Logistics;MEL43251909645FMXDF01
Plantilla Gel Ergonomica Profesional Comodidas Talla 38 - 42Tamaño de la plantilla : 38 - 42GTCH-E-8;Mercado Envíos Flex;TOR.TECHONOLOGY;43252014186
Mancuernas Pesas Barra Recta Ejercicio Kit Ajustables 20kgColor : SEGUN DISPONIBILIDADVMX-AD-60;Colecta de Mercado Envíos;MELI Logistics;MEL43251941914FMXDF01
Manguera Agua Expandible Magic Hose Con Pistola 30 Mt LavadoColor : SEGUN DISPONIBILIDADGT-AD-24;Colecta de Mercado Envíos;Envia;MEL43251775689FMXDF01
Máquina Quita Horquilla PortátilColor : SEGUN DISPONIBILIDADIPEGA-AD-60;Mercado Envíos Flex;TOR.TECHONOLOGY;43251772399
Mini Compresor De Aire Inflador Forma De Llantas PortátilColor : COLORES | Fase eléctrica : Monofásica | Frecuencia : 1 | Voltaje : 110VELH-S-16;Mercado Envíos Flex;TOR.TECHONOLOGY;43251770859
Lampara Solar 4 Bombillos Led De Emergencia Futbol 2029 FocoColor : Colores | Voltaje : 110VIND-S-16;Colecta de Mercado Envíos;MELI Logistics;MEL43251897876FMXDF01
Máquina Quita Horquilla PortátilColor : SEGUN DISPONIBILIDADIPEGA-AD-47;Colecta de Mercado Envíos;MELI Logistics;MEL43251728805FMXDF01
Dispensador Eléctrico Usb Recargable Bomba De Agua 4w UsbColor : SEGUN DISPONIBILIDADVMX-AD-7;Colecta de Mercado Envíos;MELI Logistics;MEL43251693623FMXDF01
Producto Generico - House Of Marley Redemption Anc: Auricul.Color : Negro | Color de la luz : BlancoICL-E-85;Colecta de Mercado Envíos;MELI Logistics;MEL43251686877FMXDF01
Docking Hub Tipo C 5 En 1 Adaptador Con EthernetColor : GrisSTCK-45-M;Mercado Envíos Flex;TOR.TECHONOLOGY;43251665393
Multitoma Corriente Torre 4 Niveles 16 Tomas 2500w X 3 UsbColor : COLORES | Voltaje : 127VDTR-S-47;Mercado Envíos Flex;TOR.TECHONOLOGY;43251783028
Máquina Quita Horquilla PortátilColor : Según disponibilidadIPEGA-AD-47;Colecta de Mercado Envíos;MELI Logistics;MEL43251612439FMXDF01
Pastillero Triturador Partidor Pastillas Medicamentos Divide FAKA-AD-7;Colecta de Mercado Envíos;MELI Logistics;MEL43251715132FMXDF01
Tapete De Baile Xtreme, Directo A Tv, Y Pc Usb+ Juego CI-M-55;Colecta de Mercado Envíos;MELI Logistics;MEL43251713104FMXDF01
Gimnasio Didactico Juego Para Bebe Tapete Piano Musical ROMAN-AD-60;Colecta de Mercado Envíos;MELI Logistics;MEL43251568337FMXDF01
Máquina Automática De Yogur De 1 Litro, Herramienta De BricoColor : SEGUN DISPONIBILIDAD | Voltaje : 110/220VMX-AD-20;Mercado Envíos Flex;TOR.TECHONOLOGY;43251704068
Papa Bolinha Profesional Ropa Portátil Recargable AColor : SEGUN DISPONIBILIDADVMX-AD-9;Colecta de Mercado Envíos;MELI Logistics;MEL43251692492FMXDF01
Reflector Lampara Led Portátil Solar Exterior RecargableColor de la carcasa : Colores | Color de la luz : Colores | Voltaje : 110VIND-S-35;Colecta de Mercado Envíos;MELI Logistics;MEL43251695788FMXDF01
Cámara P V380, Monitor Solar Para Exteriores, 4g, Para Uso DColor : SEGUN DISPONIBILIDADCI-AD-220;Mercado Envíos Flex;TOR.TECHONOLOGY;43254065531
Organizador De Maquillaje Giratorio De 360 Grados, Estuche D IMH-S-20;Mercado Envíos Flex;TOR.TECHONOLOGY;43253950049
Candado Moto Alarma Freno De Disco + Candado Manilar Seguro VMX-AD-13;Mercado Envíos Flex;TOR.TECHONOLOGY;43254041450
Dispensador Automatico De Agua Para Botellon Recargable Econ Color Blanco/negro VMX-S-7;Mercado Envíos Flex;TOR.TECHONOLOGY;43248437824
Lapiz Acupuntura 4 En 1 Masajeador Electrico VLZ-S-17;Mercado Envíos Flex;TOR.TECHONOLOGY;43253620172
Mini Dron E88 New Rc 4k Hd Barato Con Doble Cámara [u] [u]Color : SEGUN DISPONIBILIDADMARCELO-AD-140;Mercado Envíos Flex;TOR.TECHONOLOGY;43253593318
Encrespador Eléctrico PestañasColor : ColoresDG-S-10;Mercado Envíos Flex;TOR.TECHONOLOGY;43253419157
Manguera Expandible Magic Hose 30 Metros + Pistola Color Verde GT-S-24;Mercado Envíos Flex;TOR.TECHONOLOGY;43253346949
Mesa Laptop Portátil Computador Tablet Cama DesayunoColor : RosaVTV-E-35;Colecta de Mercado Envíos;MELI Logistics;MEL43253315335FMXDF01
Zapatera Closet De 9 Niveles Armable Color Negro SEBASTIAN-AD-40;Mercado Envíos Flex;TOR.TECHONOLOGY;43253458650
Olla Para Derretir Chocolate Juego De Fondue EléctricaColor : Naranja claroDTRNK-36-F;Mercado Envíos Flex;TOR.TECHONOLOGY;43253289779
Destapa Cañerías De Bomba Manual Con Presión Para Desagües IND-S-20;Mercado Envíos Flex;TOR.TECHONOLOGY;43253383896
Audífono Motorola Moto Buds 085 Tws Negro Luz Na ICL-E-145;Mercado Envíos Flex;TOR.TECHONOLOGY;43253217545
Aire Acondicionado Portátil Enfriador Personal Usb ArcticColor : Blanco | Voltaje : 110V/220VTS-27-F;Mercado Envíos Flex;TOR.TECHONOLOGY;43253207035
Molino Eléctrico Para Maíz Carne 2500w 6 En 1 Con Embutidor RD-120F;Mercado Envíos Flex;TOR.TECHONOLOGY;43253205077
Lapicero Esfero Bolígrafo Espía De Lujo Hd 1920x1080 P Para Vídeo Fotos Y Audios CI-AD-25;Mercado Envíos Flex;TOR.TECHONOLOGY;43253179746
Bolso Impermeable Ocean Pack 5 LitrosColor : ColoresIND-S-15;Mercado Envíos Flex;TOR.TECHONOLOGY;43253173642
Mini Lampara Led-uv De Clip - Press On - Clip Uv LamparaColor : Negro | Voltaje : 6WDTRNK-14-F;Mercado Envíos Flex;TOR.TECHONOLOGY;43253013047
Maquina De Obleas Y Conos Moliax MVM-90-F;Mercado Envíos Flex;TOR.TECHONOLOGY;43252991443
Grifo Con Sensor Inteligente Dispositivo Ahorro De AguaAcabado : Brillante | Color : PlateadoBUG-85-F;Mercado Envíos Flex;TOR.TECHONOLOGY;43253097466
Licuadora Sokany Industrial Potente 2.5l 9 VelocidadesColor : Negro/Rojo | Voltaje : 110VDSR-E-200;Mercado Envíos Flex;TOR.TECHONOLOGY;43252780119
Base Refrigerante Portátil 4 Ventiladores 5 Niveles GamerColor : NegroDRMTCH-45F;Mercado Envíos Flex;TOR.TECHONOLOGY;43252898325
Humidificador Difusor De Aromas Estilo ChimeneaColor : COLORES | Voltaje : 110VZKS-33;Mercado Envíos Flex;TOR.TECHONOLOGY;43253016468
Molino Triturador Eléctrico 2 En 1 Grande Con Licuadora RD-43-F;Mercado Envíos Flex;TOR.TECHONOLOGY;43253012246
Camara Espia Video Grabadora Con Audio Gancho PercheroColor : NegroCM-35-J;Mercado Envíos Flex;TOR.TECHONOLOGY;43252736849
Palanca Levanta Muebles | De Uso Fácil | 4 Bases Deslizantes LOC-10;Mercado Envíos Flex;TOR.TECHONOLOGY;43252846392
Afeitadora Eléctrica Portátil Mini-shave Recargable Por UsbColor : Plateado | Voltaje : 110VRD-9-F;Mercado Envíos Flex;TOR.TECHONOLOGY;43252819198
Espejo Retrovisor Con Camara Táctil Dual 1080p Fullhd M1 Pro CI-AD-120;Mercado Envíos Flex;TOR.TECHONOLOGY;43252805936
Correa Portabebes Cargador Para Bebe CanguroColor : Rosa | Nombre del diseño : plano | Talla : unicaZKS-18;Mercado Envíos Flex;TOR.TECHONOLOGY;43252590355
Cabina Sonivox Recargable Micrófono Bluetooth Vs-sp1455 400wColor : Negro | Voltaje : 110V/220VPRCH-160;Mercado Envíos Flex;TOR.TECHONOLOGY;43246914106
Pesa Gramera Cocina Analoga Mecanica 1000grsColor : RojoZKSO-8-F;Mercado Envíos Flex;TOR.TECHONOLOGY;43252162601
Cámara Espia Boligrafo Esfero Con Cámara Full Hd 1080pColor : NegroCM-25;Mercado Envíos Flex;TOR.TECHONOLOGY;43252093103
Balde Plegable 10ltsen SiliconaColor : ColoresFAK-18-F;Mercado Envíos Flex;TOR.TECHONOLOGY;43252053321
Correa Portabebes Cargador Para Bebe CanguroColor : Gris | Nombre del diseño : plano | Talla : UNICAZKS-18;Mercado Envíos Flex;TOR.TECHONOLOGY;43252064455
Perchero Doble Portatil Organizador Y Zapatero 180 Cm Yx9112Color : COLORESELH-S-50;Mercado Envíos Flex;TOR.TECHONOLOGY;43252009365
Organizador Cosmetiquera Bolso Maquillaje Neceser Viaje YanuColor : RosaDG-14;Mercado Envíos Flex;TOR.TECHONOLOGY;43252142594
Lámpara Led Panel Solar Y Sensor De Movimiento Tipo CámaraColor : Blanco | Voltaje : 110VDG-20;Colecta de Mercado Envíos;Coordinadora;MEL43254788750FMXDF01
Máquina Patillera Vgr Recargable Color Plateado 110v IRB-E-30;Mercado Envíos Flex;TOR.TECHONOLOGY;43254549099
Guante Masajeador Con Balines Relajante Corporal Derma TerapColor : COLORES | Voltaje : 0ZKSO-4.5-F;Colecta de Mercado Envíos;MELI Logistics;MEL43254487817FMXDF01
Mini Licuadora Portatil Recargable Tipo Botella 350 Ml RosaColor : COLORES | Voltaje : 1ELH-S-18;Colecta de Mercado Envíos;MELI Logistics;MEL43254629202FMXDF01
Tapete Extra Grande Plegable Para Bebé 200x180 Cm Doble Faz ROMAN-AD-85;Colecta de Mercado Envíos;MELI Logistics;MEL43254463693FMXDF01
Molinillo De Café Eléctrico Especias Pulverizador DomésticoColor : Plateado | Voltaje : 0MVM-25-F;Colecta de Mercado Envíos;MELI Logistics;MEL43254601634FMXDF01
Lavador De Vasos Tazas Copas De Lavaplatos Automático Lavado VLZ-11-F;Colecta de Mercado Envíos;MELI Logistics;MEL43254412305FMXDF02
Cepillo Exfoliante Para Cuerpo - Unidad a $18900 DG-10;Colecta de Mercado Envíos;MELI Logistics;MEL43254407797FMXDF01
Tijeras Profesionales Costura Con Guia Láser Corte RectoColor : NegroZKSO-9-F;Mercado Envíos Flex;TOR.TECHONOLOGY;43254519636
Mini Proyector Led Video Beam Yg300 Hdmi Usb Av 600 LumenesColor : Amarillo | Voltaje : 110VRC-AD-78;Mercado Envíos Flex;TOR.TECHONOLOGY;43254346829
Soporte North Bayou Nbc3-t De Pared Para Tv/monitor De 40 A 65 Negro IND-S-25;Mercado Envíos Flex;TOR.TECHONOLOGY;43254353041
Almohada Ergonómica Relajante Para Cuello Tipo NubeColor : COLORESFAK-25-F;Colecta de Mercado Envíos;MELI Logistics;MEL43254468516FMXDF01
Espejo Retrovisor Auxiliar Punto Ciego Carro FAK-5-F;Colecta de Mercado Envíos;MELI Logistics;MEL43254353500FMXDF01
