Nombre_producto;Forma_entrega;Transportadora;Numero_seguimiento
Set De 100 Bolsas Para Maquina Selladora Al Vacio 17 X 25 Cm BOLSAS EMPACADORAS AL VACIO;Colecta de Mercado Envíos;MELI Logistics;MEL43302019994FMXDF01
Casco Protector Infantil Gateo Cuidado Bebes AjustableColor : COLOR | Nombre del diseño : LisoDG-S-42;Mercado Envíos Flex;TOR.TECHONOLOGY;43302016526
Parlante Bluetooth Resistente Al Agua Manos Libres Para BañoColor : AmarilloPARLANTE DUCHA AMARILLO;Colecta de Mercado Envíos;MELI Logistics;MEL43302005186FMXDF01
Radio Walkie Talkie Baofeng Uv-s9 Plus De 10w Alcance 10 KmColor : SilverHG-140;Mercado Envíos Flex;TOR.TECHONOLOGY;43301943538
Batidora De Mano Y Pedestal Oster® Blanca Con Acción GiratorColor : Blanco | Voltaje : 110VOS-220;Mercado Envíos Flex;TOR.TECHONOLOGY;43301802009
Zapatera Closet De 9 Niveles Armable Color Negro IMH-AD-45;Mercado Envíos Flex;TOR.TECHONOLOGY;43301789435
"Soporte Escualizable Tv Base De 32 A 70 Pulgadas Kt-03 TeleColor : NEGRO 32""-70""soporte televisor 32 a 70 pulgadas";Mercado Envíos Flex;TOR.TECHONOLOGY;43301885610
Organizador De Bandejas Dispensadoras Enrollables Para Huevos, Hasta 14 Unidades, En Color Blanco ZM-M-12;Colecta de Mercado Envíos;MELI Logistics;MEL43301732243FMXDF01
Pesa Bascula Digital Cerdito Para Niños 180 KgColor : NegraBascula cerdito;Mercado Envíos Flex;TOR.TECHONOLOGY;43301701635
Cojin Gel Silicon Ergonomico Panal Comodo Asiento Auto Silla Color Azul VZ-S-16;Mercado Envíos Flex;TOR.TECHONOLOGY;43296078402
Lámpara Solar 100 Luces Led Exteriores Con Sensor Movimiento Color Negro;Colecta de Mercado Envíos;MELI Logistics;MEL43301821436FMXDF01
Camara De Seguridad 360 Bombillo 1080p Discreta Wifi RC-36;Colecta de Mercado Envíos;MELI Logistics;MEL43304265937FMXDF01
Lampara Para Escritorio Estudio Ajustable Con Brazo Flexible 110v VLZ-M-34;Colecta de Mercado Envíos;MELI Logistics;MEL43304157821FMXDF01
Cinta Kinesiológica Tape Neuromuscular Altletica 5cmColor : COLORESDG-S-8;Mercado Envíos Flex;TOR.TECHONOLOGY;43304094633
Tira De Luces Led Rgb Bluetooth Rítmica Adaptador + Control 12v TC-14;Mercado Envíos Flex;TOR.TECHONOLOGY;43304206154
Barajador Mezclador Automático De Cartas Juegos Póker NaipesColor del reverso : Negro | Idioma : Español | Personaje : PokerDD;Colecta de Mercado Envíos;MELI Logistics;MEL43304167762FMXDF01
Power Bank Treqa20.000 Mah Carga Inalambrica 4 En 1 TQ-50;Mercado Envíos Flex;TOR.TECHONOLOGY;43304105764
Plantillas Almohadillas Protector Para Tacones Calzado AltoColor : Amarillo | Tamaño de la plantilla : 35-40PLANTILLA PARA TACON;Colecta de Mercado Envíos;MELI Logistics;MEL43304055694FMXDF01
Cancha Dos En Uno Juguete Balones Básquet Futbol NiñosColor : AzulCancha futbol Verde;Mercado Envíos Flex;TOR.TECHONOLOGY;43303878629
Silla Mecedora Para Mascotas Con Altura Ajustable Perro/gatoColor : NegroTS50;Colecta de Mercado Envíos;MELI Logistics;MEL43303834071FMXDF01
Rallador De Mandolina, Queso, Patatas, Verduras, Verduras, 6 En 1 ZM-22-J;Mercado Envíos Flex;TOR.TECHONOLOGY;43303960776
Camara Para Carro Dvr Hd Lcd 2.5 Vision Nocturna Bateria TG-32;Mercado Envíos Flex;TOR.TECHONOLOGY;43303898912
Caneca Papelera Con SensorColor : BlancoEH-E-50;Colecta de Mercado Envíos;MELI Logistics;MEL43303891566FMXDF01
Linterna Manos Libres Excursionismo Frontal Recargable Zoom Color De La Linterna Negro Color De La Luz Blanco IND-S-20;Colecta de Mercado Envíos;MELI Logistics;MEL43303851742FMXDF01
Zapatero Perchero Organizador Armario 4 Niveles MultifunciónColor : NegroVT-36;Colecta de Mercado Envíos;MELI Logistics;MEL43303848882FMXDF01
Limpiador Magnetico De Ventanas VMX-AD-8;Colecta de Mercado Envíos;MELI Logistics;MEL43303790674FMXDF01
Filtro Purificador De Agua Bioenergética 14 Litros. IP-57;Colecta de Mercado Envíos;MELI Logistics;MEL43303793722FMXDF01
Lámparas Luz Led X3 Portátil Inalámbricas Adhesivas +controlColor de la luz : Blanco frío | Voltaje : 110VJUA-14.5;Mercado Envíos Flex;TOR.TECHONOLOGY;43303620739
Drone Profesional Gps Sensor Obstáculos Cámara Hd S136 Mini Color Negro RACO-300;Colecta de Mercado Envíos;MELI Logistics;MEL43303576749FMXDF01
Mesa Laptop Portátil Computador Tablet Cama DesayunoColor : Azul claroVT-35;Colecta de Mercado Envíos;MELI Logistics;MEL43303706100FMXDF01
Ventilador De Doble Cabezal Universal For Camión De 24 V VMX-AD-25;Colecta de Mercado Envíos;MELI Logistics;MEL43303695020FMXDF01
Secador De Cabello Alta Calidad Bopai Negro 220v-240v 4000w 220v - 240v LI-42;Colecta de Mercado Envíos;Envia;MEL43303536371FMXDF01
Dispensador Automático De Agua Para Botellón RecargableColor : NegroDISPENSADORBOTELLON;Mercado Envíos Flex;TOR.TECHONOLOGY;43303640760
Cojín Almohada Para Silla Asiento En Silicona ErgonomicoColor : AzulTS-17;Colecta de Mercado Envíos;MELI Logistics;MEL43303623444FMXDF01
Sillas Plegables Portátiles Inflables Con ReposapiesColor : NegroRACO-M-60;Colecta de Mercado Envíos;MELI Logistics;MEL43303455527FMXDF01
Olla Cacerola Transparente De Vidrio Templado Cocina TapaColor : Aguasd;Colecta de Mercado Envíos;MELI Logistics;MEL43303402615FMXDF01
Escurridor Platos Cocina Fregadero Acero InoxidableColor : NegroEscurridor de Platos;Mercado Envíos Flex;TOR.TECHONOLOGY;43303543026
Organizador Ropa Closet Para Jeans 9 Puestos Malla NylonColor : COLORESDG-S-14;Colecta de Mercado Envíos;MELI Logistics;MEL43303455050FMXDF01
Cinturón Masajeador VibradorColor : Negro | Talla : UNICAVIBROSHAPE;Mercado Envíos Flex;TOR.TECHONOLOGY;43303322029
Set Juego De Sartenes Ceramic Pan 5 Piezas Juego CocinaColor : RojoTVM-65;Mercado Envíos Flex;TOR.TECHONOLOGY;43303297877
Gimnasio Para Bebe Didactico Tapete Juego Ref Elefante ROMDIS-M-60;Colecta de Mercado Envíos;MELI Logistics;MEL43303284589FMXDF01
Toalla Gym Deportiva Para Enfriamiento Y Secado RápidoNombre del diseño : ENFRIAMENTOTOALLAENFRIAMIENTO;Mercado Envíos Flex;TOR.TECHONOLOGY;43303395540
Tijeras Profesionales Costura Con Guia Láser Corte RectoColor : NegroJUA-10.9;Colecta de Mercado Envíos;MELI Logistics;MEL43303204029FMXDF01
Ondulador Pinza Rizador Encrespador De Cabello Curl Perfect INDP-11-J;Colecta de Mercado Envíos;MELI Logistics;MEL43303173011FMXDF01
Guantes De Nitrilo Talla S - M - L 100 Unidades Color NegroColor : Negro | Talla : MGuantes De Nitrilo M-15;Colecta de Mercado Envíos;MELI Logistics;MEL43303169757FMXDF01
Oxímetro De Pulso Para Dedo Genérica Ab-80 Blanco/azul Oximetro Azul;Mercado Envíos Flex;TOR.TECHONOLOGY;43303278260
Cargador Inteligente De Batería 12v 6a Con Pantalla Lcd DG-E-50;Colecta de Mercado Envíos;MELI Logistics;MEL43303134733FMXDF01
Parlante Bluetooth Resistente Al Agua Manos Libres Para BañoColor : NegroPARLANTE NEGRO;Mercado Envíos Flex;TOR.TECHONOLOGY;43303273794
Difusor Humidificador De Aroma Llama De Fogata Control+esencColor : Blanco | Voltaje : 110VTS-M-80;Colecta de Mercado Envíos;MELI Logistics;MEL43303117339FMXDF01
Forro Para Mascota Protector Cojineria Carro Silla Automovil FK-15;Mercado Envíos Flex;TOR.TECHONOLOGY;43303226114
Rotectores Rodilleras Para Gateo Bebés. Cubre RodillasColor : RosaDG-6;Mercado Envíos Flex;TOR.TECHONOLOGY;43303068607
Faja Cinturón Soporte Vientre Y Cintura Maternidad AjustableColor : Negro | Talla : UNICARC-23;Colecta de Mercado Envíos;MELI Logistics;MEL43303214388FMXDF01
Organizador De Lavadora Estantes Mueble Ahorrador De EspacioColor : BlancoVZ-45;Mercado Envíos Flex;TOR.TECHONOLOGY;43303185942
Ventilador Dual Doble Cabeza Carro Cigarrera Movim AjustableColor : NegroDG-E-25;Mercado Envíos Flex;TOR.TECHONOLOGY;43302996407
Rallador Cortador Rebanador Verduras Y Frutas MultifuncionalColor : BlancoTQ-25;Mercado Envíos Flex;TOR.TECHONOLOGY;43303141726
Plantillas Ortopédicas Tecnología Gel Ajustables Tamaño De La Plantilla Hombre GTCH-E-9;Mercado Envíos Flex;TOR.TECHONOLOGY;43302975019
Tensiómetro Digital De Muñeca Exacto En Caja Medidor + CofreColor : BlancoTensiometroMuñeca;Colecta de Mercado Envíos;MELI Logistics;MEL43303094722FMXDF01
Mini Camara Ip 24 Horas App Iwf Cam Videocamara SeguridadColor : NegroCM-60-J;Colecta de Mercado Envíos;MELI Logistics;MEL43303101728FMXDF01
Parlante Bose Soundlink Micro Bluetooth Negro Bateria De Lit N/a ICL-E-460;Mercado Envíos Flex;TOR.TECHONOLOGY;43303087080
Computador De Juguete Didactico Y Educativo Para Niña Rosa CI-AD-50;Colecta de Mercado Envíos;MELI Logistics;MEL43302916895FMXDF01
Encrespador Pestañas Eléctrico - Unidad a $23900Color : NegroMATCHP-10;Colecta de Mercado Envíos;MELI Logistics;MEL43302880941FMXDF01
Molino De Carne Picador Electrico 1200w Universal Royal EH-E-150;Mercado Envíos Flex;TOR.TECHONOLOGY;43302999724
Tapas Silicona Ollas Recipientes Pack X 6 Cocina FrutasCOLORES : AZULSet Tapas silicona Azul;Mercado Envíos Flex;TOR.TECHONOLOGY;43302822185
Tapete En Piel De Durazno, Medidas De 1,50 X 2,00 MtsDiseño de la tela : VariadoVT-70;Colecta de Mercado Envíos;MELI Logistics;MEL43302971500FMXDF01
Audifonos Jbl Jbltflexblk, Color Negro ICL-E-320;Colecta de Mercado Envíos;MELI Logistics;MEL43302816569FMXDF01
Holder Pinza Yb-20-3 Soporte Celular Auto 360° VT-15;Mercado Envíos Flex;TOR.TECHONOLOGY;43302732261
Limpiador Lava Vasos Automatico Herramienta Enjuage Cocina IMH-S-12;Mercado Envíos Flex;TOR.TECHONOLOGY;43302857982
Humificador Difusor Aroma Lámpara Luna Luces Led EléctricoColor : Blanco | Voltaje : 110VGAT-M-22;Mercado Envíos Flex;TOR.TECHONOLOGY;43302690011
Ventilador Samurai 2 En 1 Comfort Maxx 18 Pulgadas Negro Cantidad De Aspas 6 Color De Las Aspas Gris Diámetro 44 Cm Material De Las Aspas 6 IND-S-218;Mercado Envíos Flex;TOR.TECHONOLOGY;43302788386
Kit X7 Makeup Soft Aplicador Suave Esponja MaquillajeColor : colores | Tamaño de la esponja : MedianaVZ-7;Colecta de Mercado Envíos;MELI Logistics;MEL43302673995FMXDF01
Juego De Herramientas Para El Hogar 27 PiezasColor : VerdeZKS-48;Mercado Envíos Flex;TOR.TECHONOLOGY;43302770392
Manguera Expandible Magic Hose 30 Metros + Pistola Color VerColor : VerdeGT-S-16;Colecta de Mercado Envíos;MELI Logistics;MEL43302647941FMXDF01
Plantilla Gel Ergonomica Profesional Comodidas Talla 38 - 42 Tamaño De La Plantilla 38 - 42 GTCH-E-8;Mercado Envíos Flex;TOR.TECHONOLOGY;43302753202
Manguera Retractil Expandible Mágica 45 Mts. + Pitón | DuguColor : VerdeGAT-28;Colecta de Mercado Envíos;MELI Logistics;MEL43302611645FMXDF01
Auriculares Para Gafas De Sol Con Carga Usb 4.1, EstéreoColor : SEGUN DISPONIBILIDAD | Color de la luz : NOVMX-AD-24;Colecta de Mercado Envíos;Coordinadora;MEL43302749946FMXDF01
Estante Giratorio 5 Niveles Cuadrado Almacenamiento VerdurasColor : NegroLI-225;Colecta de Mercado Envíos;MELI Logistics;MEL43302750592FMXDF01
Organizador Zapatero Metálico 6 Niveles Shoe Rack LRC-E-28;Mercado Envíos Flex;TOR.TECHONOLOGY;43302590077
Clip Anti Ronquido Silicona Magnética Apnea Del Sueño FK-6;Colecta de Mercado Envíos;MELI Logistics;MEL43302596069FMXDF01
Depiladora De Cristal Removedor De Vello Sin Dolor Epilator DG-6;Mercado Envíos Flex;TOR.TECHONOLOGY;43302593443
Monitor Cámara De Bebé Wifi Y Visión Nocturna 3aVoltaje : 110Vcamara 3 IPE-40;Colecta de Mercado Envíos;MELI Logistics;MEL43301681877FMXDF01
Soporte Tripode Luz Control Remoto Con Microfono Inalambrico Soporte Ay49 Luz+microSolaItipoC;Colecta de Mercado Envíos;MELI Logistics;MEL43302581031FMXDF01
Malla Protectora Y Organizadora Para AutosNombre del diseño : MallaFK-13;Mercado Envíos Flex;TOR.TECHONOLOGY;43302566365
Sarten Doble Parrilla Dessini 40cm AntiaderenteColor : NegroDRDS-75-F;Colecta de Mercado Envíos;MELI Logistics;MEL43299286749FMXDF01
Cámara De Seguridad V380-camera B13-l Con Resolución De 1.2mp Visión Nocturna Incluida Blanca CI-M-45;Colecta de Mercado Envíos;Coordinadora;MEL43302496621FMXDF01
Pelador-cortador De Frutas Y Papas Espiral Acero Inoxidable CT-29;Mercado Envíos Flex;TOR.TECHONOLOGY;43302613910
Ventilador Portatil De Cuello Recargable Personal UsbColor : BlancoVZ-21;Colecta de Mercado Envíos;MELI Logistics;MEL43302391075FMXDF01
Pesas Tobilleras 2k El Par, Pesas Para Tobillos O Muñecas GTCH-E-18;Colecta de Mercado Envíos;MELI Logistics;MEL43302589806FMXDF01
Caja De Almacenamiento De Huevos Frescos Organizador X12Color : BlancoJUA-15;Mercado Envíos Flex;TOR.TECHONOLOGY;43302423331
Triturador Y Cortador De Pastillas, Vitaminas O PildorasColor : BlancoFK-7;Colecta de Mercado Envíos;MELI Logistics;MEL43302318915FMXDF01
Soporte Pedestal Televisor Hasta 65 Pulgadas Color Negro SOPORTE PISO PEDESTAL;Mercado Envíos Flex;TOR.TECHONOLOGY;43302311815
Cojín De Fisioterapia Manta Eléctrica 30x60cm Color Gris RD-50;Colecta de Mercado Envíos;MELI Logistics;MEL43302441582FMXDF01
Tapete De Baile Xtreme, Tv, Y Pc Usb FG-M-55;Colecta de Mercado Envíos;MELI Logistics;MEL43302384766FMXDF01
Panel Solar Plegable Portatil 30w Recargue Celulares Y Mas.Color : Negro | Voltaje de circuito abierto : 10V | Voltaje máximo del sistema : 10VCHPW-E-199;Colecta de Mercado Envíos;MELI Logistics;MEL43300856805FMXDF01
Ejercitador De Dedos Fortalecedor Mano Ajustable X 2 Und Color Negro GTCH-E-8;Mercado Envíos Flex;TOR.TECHONOLOGY;43302261264
Cámara Giratoria Ptz Wifi 2.4g/5g V380 Ip Conexión EnchufeColor : BlancoDTK-50;Mercado Envíos Flex;TOR.TECHONOLOGY;43302242484
Organizador De Baño Estante Mueble Ahorra Espacio BlancoColor : METALVG-AD-48;Mercado Envíos Flex;TOR.TECHONOLOGY;43304966074
Olla Calentador De Cera De Silicona Plegable PortátilVoltaje : 110VSD;Mercado Envíos Flex;TOR.TECHONOLOGY;43304933808
Micrófono De Solapa Inalambrico Doble Para Celular iPhone TxColor : NegroHG-75;Mercado Envíos Flex;TOR.TECHONOLOGY;43304760871
Cable Vga 5 Metros - Alta Calidad Punta Azul Con Filtro DTR-S-5;Colecta de Mercado Envíos;MELI Logistics;MEL43304898578FMXDF01
Molde Silicona Hielo Facial Lim - mL a $13900Tipo de piel : Todo tipo de pielDG-8;Mercado Envíos Flex;TOR.TECHONOLOGY;43304864648
Máquina Recortadora Vgr V-082 Negra 110v/240v EH-45;Mercado Envíos Flex;TOR.TECHONOLOGY;43304715003
Closet Zapatera Armable De 9 Niveles IMH-AD-45;Mercado Envíos Flex;TOR.TECHONOLOGY;43304700551
Set Maquina Motilar Cabello + Patillera Patillas Combo V-675Color : Gris | Voltaje : 110V/220VPH-S-115;Colecta de Mercado Envíos;MELI Logistics;MEL43304844556FMXDF01
Inflador Eléctrico De Globos 600watts Doble Boquilla ZM-35-J;Colecta de Mercado Envíos;MELI Logistics;MEL43304671587FMXDF01
Maquina Selladora Bolsas Vacio Empacadora AutomaticaVoltaje : 110V/220Vempacadoralvacio;Colecta de Mercado Envíos;Envia;MEL43304636235FMXDF01
Estante Rectangular 4 Niveles Multiusos Almacenamiento RuedaColor : COLORESIND-S-70;Colecta de Mercado Envíos;MELI Logistics;MEL43304807310FMXDF01
Mesa Laptop Portátil Computador Tablet Cama Desayuno;Mercado Envíos Flex;TOR.TECHONOLOGY;43304794228
Calentador Hervidor D Agua Eléctrico Plegable Portátil 600mlColor : AzulJarra Hervidora Azul;Colecta de Mercado Envíos;MELI Logistics;MEL43304781486FMXDF01
Mandolina Cortador Verduras Multi Picador Vegetales 15 En 1 Mandolina 15 en 1 Verde-25;Colecta de Mercado Envíos;MELI Logistics;MEL43304773138FMXDF01
"Ventilador Pie Recargable Panel Solar Bombillas Led Gd-8036Cantidad de aspas : 4 | Color de la estructura : Blanco | Color de las aspas : Blanco | Diámetro : 10 "" | Frecuencia : 10 | Material de las aspas : Plástico | Voltaje : 110VTG-E-215";Colecta de Mercado Envíos;MELI Logistics;MEL43304693060FMXDF01
Canasta Porta Huevos Organizador X24 Con Tapa Cocina BlancoColor : Blancosd;Mercado Envíos Flex;TOR.TECHONOLOGY;43304544749
Masajeador Eléctrico-cervical Cuello Espalda Brazos InfrarroColor : Beige | Voltaje : 110V/220VMASAJEADORCUELLOCERVICAL;Mercado Envíos Flex;TOR.TECHONOLOGY;43304673052
Espatula Peeling Ultrasonico Limpiador Facial Lifting VZ-20;Colecta de Mercado Envíos;Envia;MEL43304473583FMXDF01
Closet Armario Doble Desarmable Con Forro 3 Espacios NegroColor : NegroIMPORHAUSE-AD-70;Mercado Envíos Flex;TOR.TECHONOLOGY;43304440101
Calentador De Biberón/tetero Para Bebe Portatil Usb ViajeroColor : Dorado champaña | Voltaje : 110VDG-M-18;Mercado Envíos Flex;TOR.TECHONOLOGY;43304584624
Pinza Rizadora Princesa Cabello Re-2072 RizosColor : Negro | Voltaje : 12PRH-E-25;Mercado Envíos Flex;TOR.TECHONOLOGY;43304511482
Termo Botella De Agua Con Cristales De Cuarzo + EstucheColor : RosadoTermo Con Cuarzo Rosado;Colecta de Mercado Envíos;Envia;MEL43303386772FMXDF01
Media Compresión Anti Varices Circulación UnisexColor : Negro | Talla : S/MTQ-9;Colecta de Mercado Envíos;MELI Logistics;MEL43304504728FMXDF01
Barra Mancuerna 35cm Caucho Seguros Roscables Pesa EjercicioColor : GrisIF-20;Colecta de Mercado Envíos;MELI Logistics;MEL43304345757FMXDF01
Mini Kit De Costura Manual Portátil Viajero Hilo Agujas MV-15;Colecta de Mercado Envíos;MELI Logistics;MEL43304343415FMXDF01
Corrector De Juanete Para Ambos Pies De Silicona Talla Estándar ZM-2-J;Mercado Envíos Flex;TOR.TECHONOLOGY;43304350041
Cargador Portátil Power Bank 12.800mah TreqaColor : NegroTQ-23;Colecta de Mercado Envíos;MELI Logistics;MEL43301010726FMXDF01
Parrilla De Carbon Portatil Barril Asador Barbacoa ChimeneaColor : NegroFK-AD-140;Mercado Envíos Flex;TOR.TECHONOLOGY;43305284859
Tripode Con Soporte De Celular Y Control Bluetooth Dk-3888Color : Grissd;Colecta de Mercado Envíos;MELI Logistics;MEL43305279565FMXDF01
Auriculares Manos Libres Lighting TreqaColor : BlancoTQ-9-J;Mercado Envíos Flex;TOR.TECHONOLOGY;43305232853
Kit Bandas De Resistencia Elásticas Planas Cerradas X 3Color : NegroGOT-10;Colecta de Mercado Envíos;MELI Logistics;MEL43305361040FMXDF01
Compresor De Aire Mini A Batería Portátil Camel 628-4x4 12v Gris RD-65;Colecta de Mercado Envíos;MELI Logistics;MEL43305211919FMXDF01
Base Soporte Montura Arnes Casco Camara Gopro MotoColor : COLORESDTR-S-22;Mercado Envíos Flex;TOR.TECHONOLOGY;43305360530
Lonchera Térmica Infantil Con Asa Dino Yellow Dinosaur DG-10;Mercado Envíos Flex;TOR.TECHONOLOGY;43305185187
Combo Gamer 4 En 1 Unitec Km18 Rgb Negro/azulColor del teclado : Negro/AzulTQ-40;Mercado Envíos Flex;TOR.TECHONOLOGY;43305183681
Tapete Bebe Alfombra Gateo 150x180 Cm Tapete Didáctico PH-32;Mercado Envíos Flex;TOR.TECHONOLOGY;43305011281
Funda Malla Lavadora Cuidado Zapato Tenis Pequeña Hogar LimpColor : BlancoDG-8;Colecta de Mercado Envíos;MELI Logistics;MEL43305139551FMXDF01
Batidora De Pedestal Black+decker Mx900 Blanca Y Champán 60 Hz 120 v LI-143;Colecta de Mercado Envíos;MELI Logistics;MEL43304976568FMXDF01
Freidora De Aire Renahouse Rh97 De 12l Color Negro 120v RNH-M-360;Mercado Envíos Flex;TOR.TECHONOLOGY;43305253272
Rollo De Cinta Kinesiologica Neuromuscular Kinesiotape Color Colores DG-M-5;Colecta de Mercado Envíos;MELI Logistics;MEL43305080917FMXDF01
Bascula Balanza Pesa Digital App Bluetooth Gym 180 KgColor : Negro | Voltaje : 110RC-AD-18;Colecta de Mercado Envíos;MELI Logistics;MEL43305232150FMXDF01
Kit Micrófono Profesional De Condensador + Tarjeta Sonido V8Color : ColoresDG-S-90;Mercado Envíos Flex;TOR.TECHONOLOGY;43305218202
Parlante Bluetooth Resistente Al Agua Manos Libres Para BañoColor : RosaPARLANTE ROSADO;Colecta de Mercado Envíos;MELI Logistics;MEL43305004535FMXDF01
Cooler Portátil Para Automóvil Camping Viajes Refrigerador 95-J-TQJ;Colecta de Mercado Envíos;MELI Logistics;MEL43305015713FMXDF01
Limpiador Extractor Puntos NegrTipo de piel : Todosextractorprofesional;Mercado Envíos Flex;TOR.TECHONOLOGY;43305126254
Cepillo Peine Removedor De Pelo Para Mascotas Perros GatosColor : AzulCEPILLO PET ZOOM;Mercado Envíos Flex;TOR.TECHONOLOGY;43305124884
Lampara De Lava Luz Decorativa Dormitorio U Oficina CeraColor de la estructura : Plateado | Color de la pantalla : ColoresSTCK-55-F;Colecta de Mercado Envíos;MELI Logistics;MEL43303459105FMXDF01
Maquina Peluquera Para Perros Y Gatos Geemy Accesorios 1023 40-J-TQJ;Colecta de Mercado Envíos;MELI Logistics;MEL43304955931FMXDF01
Kit Carga Y Juega Bateria Pila Xbox 360 De Cargador Control KIT Carga XBOX 360;Colecta de Mercado Envíos;MELI Logistics;MEL43304934761FMXDF01
Tira De Luces Led Rgb 10 Metros Alexa Control De Voz 110v 110v/220v DTECH-S-32;Colecta de Mercado Envíos;MELI Logistics;MEL43305054146FMXDF01
Alfombra Para Cocina Mattitude, Antifatiga, Impermeable, 2u.Ancho : 40 cm | Color : Gris | Diseño de la tela : liso | Largo : 120 cmMV-ad-30;Mercado Envíos Flex;TOR.TECHONOLOGY;43305494842
Bicicleta Estatica Máquina Spinning Spin Bike X Speed 17 K Color Negro/azul VMX-S-450;Colecta de Mercado Envíos;MELI Logistics;MEL43305696455FMXDF01
Botella Licuadora Juguera Portatil Recargable UsbColor : BlancoTQ-14;Colecta de Mercado Envíos;MELI Logistics;MEL43305698640FMXDF01
Kit Molde Protector De Silicona Airfryer X 6 PzasColor : COLORESDG-S-7;Mercado Envíos Flex;TOR.TECHONOLOGY;43305688979
Cepillo Diente Eléctrico NiñosColor : COLORESDG-S-20;Mercado Envíos Flex;TOR.TECHONOLOGY;43305681237
Mini Licuadora Exprimidor Recargable Usb Batido Jugo Natural Mini Licuadora Juice;Colecta de Mercado Envíos;MELI Logistics;MEL43305822790FMXDF01
Rociador Giratorio Automatico Tres Puntas Ajustable FK-10;Colecta de Mercado Envíos;MELI Logistics;MEL43305658023FMXDF01
Porta Comida Fiambrera Lonchera Oso Con Lentes Para NiñosColor : MarrónDG-30;Mercado Envíos Flex;TOR.TECHONOLOGY;43305647351
Mi Primer Portátil Infantil Mini Laptop Educativo SonidoColor : RosaIMPH-20;Mercado Envíos Flex;TOR.TECHONOLOGY;43305608537
Kit Herramienta Set X27 Caja De Herramientas Multifuncional Kit Herramientas YL 8027;Colecta de Mercado Envíos;MELI Logistics;MEL43305609713FMXDF01
Rotectores Rodilleras Para Gateo Bebés. Cubre RodillasColor : Rosa | Nombre del diseño : LisoDG-6;Colecta de Mercado Envíos;MELI Logistics;MEL43305456417FMXDF01
Candado Alarma De Seguridad Para Motos, Bicicletas Otros RACO-13;Colecta de Mercado Envíos;MELI Logistics;MEL43305721590FMXDF01
Organizador Frasco Hermetico Cocina Tupper Recipiente Set X7 Color Negro IMPORH-AD-50;Mercado Envíos Flex;TOR.TECHONOLOGY;43305713182
Multi Puertos Usb 3.0 7 Puertos Con InterruptorColor : NegroHUGE-AD-5;Mercado Envíos Flex;TOR.TECHONOLOGY;43305678000
Gatillo Gamepad Para Juegos Celular Soporte Diversion Ak16 CI-M-5;Mercado Envíos Flex;TOR.TECHONOLOGY;43305702276
Manguera Expandible Flexible 30 Metros Con Aspersor Jardin Color Verde RAC-M-16;Colecta de Mercado Envíos;MELI Logistics;MEL43305611954FMXDF01
Encrespador Pestañas EléctricoColor : BlancoDG-10;Colecta de Mercado Envíos;MELI Logistics;MEL43305515051FMXDF01
Lampara Panel Solar Exteriores Led Y Sensor Fachadas Pared Color Negro IP-15;Mercado Envíos Flex;TOR.TECHONOLOGY;43304623870
Maquina Portatil Mini Sewing Machine Con Base Para Coser Color Blanco 42-J-TQJ;Mercado Envíos Flex;TOR.TECHONOLOGY;43305646814
Adaptador Multitoma Convertidor Enchufe 3 En 1 GiratorioColor : colores | Voltaje : 127VTVM-2;Colecta de Mercado Envíos;MELI Logistics;MEL43305638716FMXDF01
Camara Ip Rotica Tipo Bombillo Wifi 360° Vision NocturnaColor : BlancoRC-36;Colecta de Mercado Envíos;MELI Logistics;MEL43305467371FMXDF01
Set De Poker Tipo Casino Texas Hold Fichas Cartas Tapete!! TGRS-25-F;Colecta de Mercado Envíos;MELI Logistics;MEL43305469103FMXDF01
Papel Adhesivo Tapiz Vinilo Marmol Cocina Meson 60cm X 200cmColor : A DISPONIBILIDADMV-AD-10;Colecta de Mercado Envíos;MELI Logistics;MEL43305599454FMXDF01
Bolso Cosmetiquera Impermeable Maquillaje Wash Bag Baul Color Rosa Diseño De La Tela Liso DG-S-10;Mercado Envíos Flex;TOR.TECHONOLOGY;43305573996
Cinta Kinesiologicas Terapéutica Vendaje MuscularColor : COLORESCINTA KINEAS MUSCULAR PEPE;Mercado Envíos Flex;TOR.TECHONOLOGY;43305413561
Candado-alarma Freno Disco Seguridad Para Motocicleta Y Bici RD-25;Colecta de Mercado Envíos;MELI Logistics;MEL43305530322FMXDF01
Juego Bombilla X3 Luces Led Inalámbrica Con Control De MandoColor de la luz : BlancoTGRS-23-F;Colecta de Mercado Envíos;MELI Logistics;MEL43305517634FMXDF01
Nuevas Planchas Ultrasuaves De Nanotitanio De 450 °f De PranColor : Azul | Voltaje : 110VTQJ-J-35;Mercado Envíos Flex;TOR.TECHONOLOGY;43305357427
"Ventilador Portatil Pequeño Grip Go De 3 VelocidadesCantidad de aspas : 2 | Color de la estructura : Blanco | Color de las aspas : Blanco | Diámetro : 10 "" | Frecuencia : 1 | Material de las aspas : Plástico | Voltaje : 110V/220VJUA-33.2";Mercado Envíos Flex;TOR.TECHONOLOGY;43305349879
Encendedor De Arco Eléctrico Recargabl - G A MV-AD-18;Colecta de Mercado Envíos;Envia;MEL43305332351FMXDF01
Simulación 3d Del Humidificador Difusor De LlamaColor : SEGUN DISPONIBILIDAD | Voltaje : 110VVMX-AD-55;Colecta de Mercado Envíos;MELI Logistics;MEL43305342813FMXDF01
Soporte Base De Brazo Para Tv Televisión De 10 A 32 PulgadasColor : NegroTC-16;Mercado Envíos Flex;TOR.TECHONOLOGY;43305332365
Recipientes Organizadores Comida Hermeticos Sellables Set 6 IMPORTH-AD-43;Colecta de Mercado Envíos;MELI Logistics;MEL43305476620FMXDF01
Tendederos De Ropa Plegables Mc-60 NuevoColor : AluminioTendedero Aluminio MC-60;Mercado Envíos Flex;TOR.TECHONOLOGY;43307788724
Mini Maquina De Coser Manual Pequeña De Mano Handy Stitch 12-J-TQJ;Mercado Envíos Flex;TOR.TECHONOLOGY;43307752816
Bolsa Seca Tula Impermeable Maleta Resistente Agua 10 Litros LI-28;Mercado Envíos Flex;TOR.TECHONOLOGY;43307642750
Mini Ventilador Para Carro 12 V Portátil Giratorio PotenteColor : COLORESIND-S-30;Colecta de Mercado Envíos;MELI Logistics;MEL43307590502FMXDF01
Mini Plancha Viajera Portátil De Pelo Nova Sx-8006 LI-AD-8;Colecta de Mercado Envíos;MELI Logistics;MEL43307402611FMXDF01
Escalera Portatil Multipropósito 16 Pasos Color Plateado VMX-M-285;Colecta de Mercado Envíos;MELI Logistics;MEL43307434846FMXDF01
Alfombrilla Silicona Grifo Contra Salpicaduras Para GrifoColor : GrisRD-7;Mercado Envíos Flex;TOR.TECHONOLOGY;43307372038
