Nombre_producto;Forma_entrega;Transportadora;Numero_seguimiento
Removedor Calculos Dental UltrasonicoVoltaje : 110DG-S-28;Correo y puntos de despacho;MELI Logistics;MEL43245900304FMDOF01
Secador De Cabello Keratin Protect 3000w 2003Color : Negro | Voltaje : 110V/220VVMX-AD-18;Correo y puntos de despacho;MELI Logistics;MEL43253361263FMDOF01
Lampara De Escritorio Recargable Decorativa Rgb TouchcontrolColor de la estructura : Colores | Color de la pantalla : Colores | Voltaje : 110VIND-S-18;Correo y puntos de despacho;MELI Logistics;MEL43252776428FMDOF01
Licuadora Osterizer® Max Con Vaso De Vidrio De 1,75 L BlstpbColor : Gris | Voltaje : 110VOS-E-600;Correo y puntos de despacho;MELI Logistics;MEL43254903846FMDOF01
Manguera Agua Expandible 15 Mts - Unidad a $22900 VMX-AD-12;Correo y puntos de despacho;MELI Logistics;MEL43259220298FMDOF01
Cepillo Dental Limpiador De Sarro Calculo Dental ElectrónicoVoltaje : 127VVG-AD-23;Correo y puntos de despacho;Envia;MEL43273920016FMDOF01
Tendedero De Piso Estante Plegable 2 Niveles Secado Ropa MaxColor : ColoresIMH-S-28;Correo y puntos de despacho;MELI Logistics;MEL43278493193FMDOF01
Plantilla Gel Ergonomica Profesional Comodidas Talla 38 - 42Tamaño de la plantilla : 38 - 42GTCH-E-8;Correo y puntos de despacho;MELI Logistics;MEL43279045256FMDOF01
Mancuernas Pesas Barra Recta Ejercicio Kit Ajustables 20kgColor : SEGUN DISPONIBILIDADVMX-AD-60;Correo y puntos de despacho;MELI Logistics;MEL43280944997FMDOF01
Manguera Agua Expandible Magic Hose Con Pistola 30 Mt LavadoColor : SEGUN DISPONIBILIDADGT-AD-24;Correo y puntos de despacho;MELI Logistics;MEL43282777543FMDOF01
Máquina Quita Horquilla PortátilColor : SEGUN DISPONIBILIDADIPEGA-AD-60;Correo y puntos de despacho;MELI Logistics;MEL43285640321FMDOF01
Mini Compresor De Aire Inflador Forma De Llantas PortátilColor : COLORES | Fase eléctrica : Monofásica | Frecuencia : 1 | Voltaje : 110VELH-S-16;Correo y puntos de despacho;MELI Logistics;MEL43286586479FMDOF01
Lampara Solar 4 Bombillos Led De Emergencia Futbol 2029 FocoColor : Colores | Voltaje : 110VIND-S-16;Correo y puntos de despacho;MELI Logistics;MEL43286057416FMDOF01
Máquina Quita Horquilla PortátilColor : SEGUN DISPONIBILIDADIPEGA-AD-47;Correo y puntos de despacho;MELI Logistics;MEL43285855823FMDOF01
Dispensador Eléctrico Usb Recargable Bomba De Agua 4w UsbColor : SEGUN DISPONIBILIDADVMX-AD-7;Correo y puntos de despacho;MELI Logistics;MEL43297630387FMDOF01
Producto Generico - House Of Marley Redemption Anc: Auricul.Color : Negro | Color de la luz : BlancoICL-E-85;Correo y puntos de despacho;MELI Logistics;MEL43298476162FMDOF01
Docking Hub Tipo C 5 En 1 Adaptador Con EthernetColor : GrisSTCK-45-M;Correo y puntos de despacho;MELI Logistics;MEL43301075670FMDOF01
Multitoma Corriente Torre 4 Niveles 16 Tomas 2500w X 3 UsbColor : COLORES | Voltaje : 127VDTR-S-47;Correo y puntos de despacho;MELI Logistics;MEL43303336849FMDOF01
Máquina Quita Horquilla PortátilColor : Según disponibilidadIPEGA-AD-47;Correo y puntos de despacho;MELI Logistics;MEL43302660325FMDOF01
Pastillero Triturador Partidor Pastillas Medicamentos Divide FAKA-AD-7;Correo y puntos de despacho;MELI Logistics;MEL43306896055FMDOF01
Tapete De Baile Xtreme, Directo A Tv, Y Pc Usb+ Juego CI-M-55;Mercado Envíos Flex;GONZALEZEDISON20220903104007;43315152834
Gimnasio Didactico Juego Para Bebe Tapete Piano Musical ROMAN-AD-60;Mercado Envíos Flex;GONZALEZEDISON20220903104007;43314009704
Máquina Automática De Yogur De 1 Litro, Herramienta De BricoColor : SEGUN DISPONIBILIDAD | Voltaje : 110/220VMX-AD-20;Correo y puntos de despacho;MELI Logistics;MEL43313915000FMDOF01
Papa Bolinha Profesional Ropa Portátil Recargable AColor : SEGUN DISPONIBILIDADVMX-AD-9;Correo y puntos de despacho;MELI Logistics;MEL43312623754FMDOF01
Reflector Lampara Led Portátil Solar Exterior RecargableColor de la carcasa : Colores | Color de la luz : Colores | Voltaje : 110VIND-S-35;Mercado Envíos Flex;GONZALEZEDISON20220903104007;43313225946
Cámara P V380, Monitor Solar Para Exteriores, 4g, Para Uso DColor : SEGUN DISPONIBILIDADCI-AD-220;Mercado Envíos Flex;GONZALEZEDISON20220903104007;43312660870
Organizador De Maquillaje Giratorio De 360 Grados, Estuche D IMH-S-20;Correo y puntos de despacho;MELI Logistics;MEL43316035059FMDOF01
Candado Moto Alarma Freno De Disco + Candado Manilar Seguro VMX-AD-13;Correo y puntos de despacho;MELI Logistics;MEL43314483156FMDOF01
Dispensador Automatico De Agua Para Botellon Recargable Econ Color Blanco/negro VMX-S-7;Mercado Envíos Flex;GONZALEZEDISON20220903104007;43316993765
Lapiz Acupuntura 4 En 1 Masajeador Electrico VLZ-S-17;Mercado Envíos Flex;GONZALEZEDISON20220903104007;43319676150
Mini Dron E88 New Rc 4k Hd Barato Con Doble Cámara [u] [u]Color : SEGUN DISPONIBILIDADMARCELO-AD-140;Correo y puntos de despacho;MELI Logistics;MEL43318185832FMDOF01
Encrespador Eléctrico PestañasColor : ColoresDG-S-10;Correo y puntos de despacho;Envia;MEL43317328945FMDOF01
Manguera Expandible Magic Hose 30 Metros + Pistola Color Verde GT-S-24;Mercado Envíos Flex;GONZALEZEDISON20220903104007;43319855848
Mesa Laptop Portátil Computador Tablet Cama DesayunoColor : RosaVTV-E-35;Correo y puntos de despacho;MELI Logistics;MEL43313062299FMDOF01
Zapatera Closet De 9 Niveles Armable Color Negro SEBASTIAN-AD-40;Correo y puntos de despacho;MELI Logistics;MEL43320536838FMDOF01
Olla Para Derretir Chocolate Juego De Fondue EléctricaColor : Naranja claroDTRNK-36-F;Correo y puntos de despacho;MELI Logistics;MEL43320209535FMDOF01
Destapa Cañerías De Bomba Manual Con Presión Para Desagües IND-S-20;Mercado Envíos Flex;GONZALEZEDISON20220903104007;43324023920
Audífono Motorola Moto Buds 085 Tws Negro Luz Na ICL-E-145;Correo y puntos de despacho;Envia;MEL43322882245FMDOF01
Aire Acondicionado Portátil Enfriador Personal Usb ArcticColor : Blanco | Voltaje : 110V/220VTS-27-F;Mercado Envíos Flex;GONZALEZEDISON20220903104007;43322209792
Molino Eléctrico Para Maíz Carne 2500w 6 En 1 Con Embutidor RD-120F;Correo y puntos de despacho;MELI Logistics;MEL43322031247FMDOF01
Lapicero Esfero Bolígrafo Espía De Lujo Hd 1920x1080 P Para Vídeo Fotos Y Audios CI-AD-25;Mercado Envíos Flex;GONZALEZEDISON20220903104007;43321741430
Bolso Impermeable Ocean Pack 5 LitrosColor : ColoresIND-S-15;Correo y puntos de despacho;MELI Logistics;MEL43321325701FMDOF01
Mini Lampara Led-uv De Clip - Press On - Clip Uv LamparaColor : Negro | Voltaje : 6WDTRNK-14-F;Mercado Envíos Flex;GONZALEZEDISON20220903104007;43321449287
Maquina De Obleas Y Conos Moliax MVM-90-F;Correo y puntos de despacho;Envia;MEL43320948385FMDOF01
Grifo Con Sensor Inteligente Dispositivo Ahorro De AguaAcabado : Brillante | Color : PlateadoBUG-85-F;Correo y puntos de despacho;MELI Logistics;MEL43321042564FMDOF01
Licuadora Sokany Industrial Potente 2.5l 9 VelocidadesColor : Negro/Rojo | Voltaje : 110VDSR-E-200;Correo y puntos de despacho;Envia;MEL43309658391FMDOF01
Base Refrigerante Portátil 4 Ventiladores 5 Niveles GamerColor : NegroDRMTCH-45F;Correo y puntos de despacho;MELI Logistics;MEL43324422791FMDOF01
Humidificador Difusor De Aromas Estilo ChimeneaColor : COLORES | Voltaje : 110VZKS-33;Correo y puntos de despacho;MELI Logistics;MEL43324459998FMDOF01
Molino Triturador Eléctrico 2 En 1 Grande Con Licuadora RD-43-F;Mercado Envíos Flex;TECHNOLOGYLUNAR20231128160211;43243126105
Camara Espia Video Grabadora Con Audio Gancho PercheroColor : NegroCM-35-J;Colecta de Mercado Envíos;Envia;MEL43242869724FMXDF01
Palanca Levanta Muebles | De Uso Fácil | 4 Bases Deslizantes LOC-10;Mercado Envíos Flex;TECHNOLOGYLUNAR20231128160211;43242671419
Afeitadora Eléctrica Portátil Mini-shave Recargable Por UsbColor : Plateado | Voltaje : 110VRD-9-F;Mercado Envíos Flex;TECHNOLOGYLUNAR20231128160211;43242642720
Espejo Retrovisor Con Camara Táctil Dual 1080p Fullhd M1 Pro CI-AD-120;Mercado Envíos Flex;TECHNOLOGYLUNAR20231128160211;43242107353
Correa Portabebes Cargador Para Bebe CanguroColor : Rosa | Nombre del diseño : plano | Talla : unicaZKS-18;Colecta de Mercado Envíos;MELI Logistics;MEL43241811228FMXDF01
Cabina Sonivox Recargable Micrófono Bluetooth Vs-sp1455 400wColor : Negro | Voltaje : 110V/220VPRCH-160;Colecta de Mercado Envíos;MELI Logistics;MEL43241641145FMXDF01
Pesa Gramera Cocina Analoga Mecanica 1000grsColor : RojoZKSO-8-F;Colecta de Mercado Envíos;MELI Logistics;MEL43241549465FMXDF01
Cámara Espia Boligrafo Esfero Con Cámara Full Hd 1080pColor : NegroCM-25;Colecta de Mercado Envíos;MELI Logistics;MEL43241522805FMXDF01
Balde Plegable 10ltsen SiliconaColor : ColoresFAK-18-F;Mercado Envíos Flex;TECHNOLOGYLUNAR20231128160211;43240323945
Correa Portabebes Cargador Para Bebe CanguroColor : Gris | Nombre del diseño : plano | Talla : UNICAZKS-18;Colecta de Mercado Envíos;Envia;MEL43239957841FMXDF01
Perchero Doble Portatil Organizador Y Zapatero 180 Cm Yx9112Color : COLORESELH-S-50;Mercado Envíos Flex;TECHNOLOGYLUNAR20231128160211;43239789198
Organizador Cosmetiquera Bolso Maquillaje Neceser Viaje YanuColor : RosaDG-14;Colecta de Mercado Envíos;MELI Logistics;MEL43238800632FMXDF01
Lámpara Led Panel Solar Y Sensor De Movimiento Tipo CámaraColor : Blanco | Voltaje : 110VDG-20;Colecta de Mercado Envíos;MELI Logistics;MEL43237330295FMXDF01
Máquina Patillera Vgr Recargable Color Plateado 110v IRB-E-30;Colecta de Mercado Envíos;MELI Logistics;MEL43246473782FMXDF01
Guante Masajeador Con Balines Relajante Corporal Derma TerapColor : COLORES | Voltaje : 0ZKSO-4.5-F;Colecta de Mercado Envíos;MELI Logistics;MEL43246167217FMXDF01
Mini Licuadora Portatil Recargable Tipo Botella 350 Ml RosaColor : COLORES | Voltaje : 1ELH-S-18;Mercado Envíos Flex;TECHNOLOGYLUNAR20231128160211;43245999041
Tapete Extra Grande Plegable Para Bebé 200x180 Cm Doble Faz ROMAN-AD-85;Mercado Envíos Flex;TECHNOLOGYLUNAR20231128160211;43246019338
Molinillo De Café Eléctrico Especias Pulverizador DomésticoColor : Plateado | Voltaje : 0MVM-25-F;Colecta de Mercado Envíos;MELI Logistics;MEL43245896626FMXDF01
Lavador De Vasos Tazas Copas De Lavaplatos Automático Lavado VLZ-11-F;Mercado Envíos Flex;TECHNOLOGYLUNAR20231128160211;43245931080
Cepillo Exfoliante Para Cuerpo - Unidad a $18900 DG-10;Colecta de Mercado Envíos;MELI Logistics;MEL43245524031FMXDF01
Tijeras Profesionales Costura Con Guia Láser Corte RectoColor : NegroZKSO-9-F;Colecta de Mercado Envíos;MELI Logistics;MEL43245325381FMXDF01
Mini Proyector Led Video Beam Yg300 Hdmi Usb Av 600 LumenesColor : Amarillo | Voltaje : 110VRC-AD-78;Colecta de Mercado Envíos;Coordinadora;MEL43245254598FMXDF01
Soporte North Bayou Nbc3-t De Pared Para Tv/monitor De 40 A 65 Negro IND-S-25;Colecta de Mercado Envíos;MELI Logistics;MEL43245040008FMXDF01
Almohada Ergonómica Relajante Para Cuello Tipo NubeColor : COLORESFAK-25-F;Mercado Envíos Flex;TECHNOLOGYLUNAR20231128160211;43245194648
Espejo Retrovisor Auxiliar Punto Ciego Carro FAK-5-F;Mercado Envíos Flex;TECHNOLOGYLUNAR20231128160211;43244688723
Interruptor Inteligente De Luz Wifi Doble Alexa Google TactiColor : BlancoCM-45;Mercado Envíos Flex;TECHNOLOGYLUNAR20231128160211;43244777938
Set Kit De Marcadores Plumones Doble Punta 168 Piezas BUG-65;Mercado Envíos Flex;TECHNOLOGYLUNAR20231128160211;43244472992
Protector Sofa, Forro, Funda, Mueble, Doble Faz 3 Puestos Color Caqui Liso VTV-E-35;Colecta de Mercado Envíos;MELI Logistics;MEL43244046146FMXDF01
Extensor De Extensión De Grifo Ajustable Giratorio De 360Color : NaranjaDTRNK-6-F;Mercado Envíos Flex;TECHNOLOGYLUNAR20231128160211;43243820167
Tendedero 4141-1 Retráctil EstirableColor : BlancoEH-70;Mercado Envíos Flex;TECHNOLOGYLUNAR20231128160211;43247051427
Funda Forro Protector Sofá Mueble Sillon 1 Puesto Sobreponer Color Marrón Rayado BGTH-15-F;Mercado Envíos Flex;TECHNOLOGYLUNAR20231128160211;43246789017
Esquinero Organizador De Ducha Multiuso 4 Repisas Ajustable Color Blanco IND-S-40;Colecta de Mercado Envíos;MELI Logistics;MEL43246658847FMXDF01
Manguera Magic Hose Expandible 45 Metros Con PistolaColor : COLORESGT-30;Colecta de Mercado Envíos;MELI Logistics;MEL43246669738FMXDF01
Reproductor De Películas Para Conferencias Led Full Hd Con Miniproyector De Primera Calidad CI-AD-150;Mercado Envíos Flex;TECHNOLOGYLUNAR20231128160211;43246487085
Casco De Seguridad Para Bebe Protector De Cabeza AntigolpeColor : COLORES | Nombre del diseño : Protector de cabeza para bebe casco de seguridad antigolpeFAK-20-F;Mercado Envíos Flex;TECHNOLOGYLUNAR20231128160211;43246472527
Camara Secreta Reloj Despertador Wifi Visión Nocturna FullhdColor : NegroDTNK-77-F;Mercado Envíos Flex;TECHNOLOGYLUNAR20231128160211;43247848034
Rodillera Larga Compresión Pierna Complet Protector DeportivColor : Negro | Talla : UnicaTRQ-15;Colecta de Mercado Envíos;MELI Logistics;MEL43247654053FMXDF01
Balanza Gramera Digital De Cocina 5000 Gramos 5 Kilos Tara Capacidad Máxima 5 G Color Plata DG-S-20;Colecta de Mercado Envíos;Envia;MEL43246546526FMXDF01
Lapicero Esfero Bolígrafo Espía De Lujo Hd 1920x1080 P Para Vídeo Fotos Y Audios CI-AD-23;Colecta de Mercado Envíos;MELI Logistics;MEL43247424457FMXDF01
Bolsa Grande Maquillaje Profesional,separadores AjustablesColor : Negro | Diseño de la tela : FixRD-90-F;Colecta de Mercado Envíos;MELI Logistics;MEL43246952053FMXDF01
Soporte Base Tv 26 A 63Color : NegroNIA-E-9;Mercado Envíos Flex;TECHNOLOGYLUNAR20231128160211;43247434254
Camara Deportiva De Video Resistente Al Agua Casco Moto Bici Color Segun Disponibilidad CI-AD-32;Mercado Envíos Flex;TECHNOLOGYLUNAR20231128160211;43247782443
Máquina De Coser Eléctrica Compacta Para El Hogar Con Luz Nocturna Portátil, Pedal De Pie Y Mesa De Mano Para Costura Recta. Incluye Kit De Dos Puntadas VT-32;Mercado Envíos Flex;TECHNOLOGYLUNAR20231128160211;43248279488
Tabla Push Up Sistema Completo De Flexiones VLZ-S-28;Mercado Envíos Flex;TECHNOLOGYLUNAR20231128160211;43250641058
Controlador De Carga Solar 10a, Regulador Inteligente Baterí IND-S-25;Mercado Envíos Flex;TECHNOLOGYLUNAR20231128160211;43250366271
Tendedero Perchero Plegable De Piso Acero Inoxidable RuedasColor : NegroTS-27-F;Colecta de Mercado Envíos;MELI Logistics;MEL43191348477FMXDF01
Esquinero Organizador De Ducha Multiuso 4 Repisas Ajustable Color Blanco IND-S-37;Colecta de Mercado Envíos;MELI Logistics;MEL43249814899FMXDF01
Llave De Impacto De Potencia Inalámbrica, Destornillador,Color : Negro | Voltaje : 110V/220VFLLGZ-35-F;Mercado Envíos Flex;TECHNOLOGYLUNAR20231128160211;43249780370
Colchón Inflable Bestway Doble De 191x137x22cm DTRNK-80-F;Mercado Envíos Flex;TECHNOLOGYLUNAR20231128160211;43249154599
Conmutador Kvm Ugreen Usb 2.0, 2 Unidades En 4 Dispositivos URG-E-140;Mercado Envíos Flex;TECHNOLOGYLUNAR20231128160211;43249188786
Lápiz Acupuntura 5 Cabezales En 1 Masajeador Eléctrico FAK-22-F;Mercado Envíos Flex;TECHNOLOGYLUNAR20231128160211;43251290578
Protector Sofa, Forro, Funda, Mueble, Doble Faz 3 Puestos Color Caqui Liso VTV-E-25;Mercado Envíos Flex;TECHNOLOGYLUNAR20231128160211;43250981009
Video Beam Proyector Mini Led Hdmi Yg300 60 Pulgadas TS-78F;Mercado Envíos Flex;TECHNOLOGYLUNAR20231128160211;43250970217
Cepillo Bucal Limpieza DentalColor : COLORESELD-22F;Colecta de Mercado Envíos;Envia;MEL43251073980FMXDF01
Sarten Wok 30 Cm Acero Inoxidable MultifunciónColor : GrisTV-M-35;Colecta de Mercado Envíos;MELI Logistics;MEL43250761307FMXDF01
Cuchara Digital Medidora Gramera Electrónica Ajustable 500g Color Blanco VRTV-12F;Colecta de Mercado Envíos;MELI Logistics;MEL43251543302FMXDF01
Organizador Y Escurridor Platos Loza Cubiertos Seca PlatosColor : NegroROOD-70;Mercado Envíos Flex;TECHNOLOGYLUNAR20231128160211;43251759516
Blanqueador De Carbón Activo Dientes Per - G FAK-8;Mercado Envíos Flex;TECHNOLOGYLUNAR20231128160211;43253891835
Molino Triturador Moledor Eléctrico 2 En 1 Grande Café Grano RD ST-43;Colecta de Mercado Envíos;MELI Logistics;MEL43253355637FMXDF01
Bolsa Organizadora Plegable Cubrelechos Sabanas Armario Tela MVM-15;Mercado Envíos Flex;TECHNOLOGYLUNAR20231128160211;43253236167
Desmenusador Triturador De Carne PolloColor : NegroBUGOT-15;Mercado Envíos Flex;TECHNOLOGYLUNAR20231128160211;43252626142
Estufa 1 Puesto Cocineta Electrica 1500wColor : Blanco | Voltaje : 110VZKSO-21;Mercado Envíos Flex;TECHNOLOGYLUNAR20231128160211;43252394146
Microfono Inalambrico Recargable- SemiprofesionalColor : ColoresMVM-43;Colecta de Mercado Envíos;MELI Logistics;MEL43252068309FMXDF01
Mesa Ajustable Multiusos Table Mate Ii Portatil PlegableColor : BlancoTC-M-42;Colecta de Mercado Envíos;MELI Logistics;MEL43252020687FMXDF01
Pistola Para Pintar 400w Elite Sprayer Pulverizador 32000rpm Color Naranja Oscuro 110v TQ-80-J;Colecta de Mercado Envíos;MELI Logistics;MEL43254469517FMXDF01
Furminator Deslanador Perro Mediano Pelo Largo BUG-20;Colecta de Mercado Envíos;MELI Logistics;MEL43248128374FMXDF01
Huggy Wuggy Muñeco Peluche Poppy Play Juguete ,Color : AzulDARDOS-35;Mercado Envíos Flex;TECHNOLOGYLUNAR20231128160211;43254602374
Mixer Licuadora De Mano 3 En 1 Dinax Batidora Picador Mixer DR-75-J;Mercado Envíos Flex;TECHNOLOGYLUNAR20231128160211;43255021642
Cámara Ip Robotic Vigilancia Wifi Visión Nocturna YooseeColor : BlancoDG-45-J;Mercado Envíos Flex;TECHNOLOGYLUNAR20231128160211;43255024329
Termo Caliente Termo Personal Termo Bebidas Calientes Thermo Color Rojo VLZ-15;Mercado Envíos Flex;TECHNOLOGYLUNAR20231128160211;43254961249
Happy Bolsa De Dormir Sleeping Para NiñosColor : TIBURON GRISGTCH-35;Mercado Envíos Flex;TECHNOLOGYLUNAR20231128160211;43254707511
Fuente De Agua Mascotas 2.5 L - GTCH-40-F;Mercado Envíos Flex;TECHNOLOGYLUNAR20231128160211;43255332383
Mini Plancha Portatil A Vapor Color Verde J-15-DR;Mercado Envíos Flex;TECHNOLOGYLUNAR20231128160211;43257487191
Organizador De Lavadora Estantes Mueble Ahorrador De EspacioColor : BlancoLI-48;Colecta de Mercado Envíos;MELI Logistics;MEL43257146690FMXDF01
Rejilla Para Secar Platos, 1 Rejilla Para Platos Easy De 3 NColor : NegroTV-M-80;Mercado Envíos Flex;TECHNOLOGYLUNAR20231128160211;43256858868
Caneca Basurero Cocina Plegable - Unidad a $22990Color : MarrónBUGOT-15;Mercado Envíos Flex;TECHNOLOGYLUNAR20231128160211;43256279093
Juego Spiner Rompecabezas Puzzle Giratorio Frijoles Magicos BUGOT-18;Mercado Envíos Flex;TECHNOLOGYLUNAR20231128160211;43256109665
Soporte Para Cepillos Uv Y Dispensador Automático De Pasta De Dientes VT-M-15;Mercado Envíos Flex;TECHNOLOGYLUNAR20231128160211;43256233066
Porta Cepillo Dispensador De Crema Dental Con Esterilizador Color Blanco GTCH-12;Colecta de Mercado Envíos;Coordinadora;MEL43256146886FMXDF01
Olla Presión 5.6 Litros Acero Inoxidable Home Elements 56ss Color Plateado ELECPRM-105F;Colecta de Mercado Envíos;MELI Logistics;MEL43255947291FMXDF01
Aro De Luz 26 Cm Con Trípode Profesional 2 M De Altura Rgb Color De La Estructura Negro 5v LI-M-30;Mercado Envíos Flex;TECHNOLOGYLUNAR20231128160211;43258031371
Mini Lavadora De Ropa Portatil Electrica Recargable Usb Color Without Box TQ-9-J;Colecta de Mercado Envíos;MELI Logistics;MEL43257871759FMXDF01
Maquina Mini Olla Fundidora De Chocolate EléctricaColor : Naranja claroDTRNK-36-F;Colecta de Mercado Envíos;MELI Logistics;MEL43257978850FMXDF01
Asador A Carbón Bbq Portable Camping Parrilla Barril GrillColor : NegroBMX-M-95;Mercado Envíos Flex;TECHNOLOGYLUNAR20231128160211;43257956300
Maquinas Para Armar CigarrillosColor : RojoGATO-40;Colecta de Mercado Envíos;MELI Logistics;MEL43257774605FMXDF01
Camara Espía Reloj De Pared 1080hd Oculta Monitoreo 24/7Color : NegroCIMA-140;Mercado Envíos Flex;TECHNOLOGYLUNAR20231128160211;43258625434
Repetidor Amplificador Señal Wifi 4antenas Rompemuros 2,4ghz Color Blanco;Mercado Envíos Flex;TECHNOLOGYLUNAR20231128160211;43259151340
Masajeador De Cuello Ayuda A Aliviar Mejor El Dolor MuscularColor : Beige | Voltaje : 110VRC-70;Mercado Envíos Flex;TECHNOLOGYLUNAR20231128160211;43259009801
Cactus Interactivo De Marvel Iroman Canta Baila Voz RepiteColor : ColoresDARDOS-35;Colecta de Mercado Envíos;MELI Logistics;MEL43259091028FMXDF01
Rueda Rodillo Entrenamiento Abdominal Grueso AntideslizanteColor : NegroFCS-35;Mercado Envíos Flex;TECHNOLOGYLUNAR20231128160211;43258916755
Teclado Bluetooth Recargable Mouse Keyboard Color Pastel KitColor del mouse : Colores | Color del teclado : COLORESCIMA-30;Mercado Envíos Flex;TECHNOLOGYLUNAR20231128160211;43258745005
Sarten De Cerámica X 5 Pcs Cerámica AntiadherentesColor : RojoOSTER-65;Colecta de Mercado Envíos;MELI Logistics;MEL43260077523FMXDF01
Panty Levanta Cola Cachetero Hueco Control Abdomen Faja DamaColor : Beige | Talla : VARIASSKSO-7;Colecta de Mercado Envíos;MELI Logistics;MEL43259686271FMXDF01
Baston Con Taser Tipo Tambo Linterna Defensa Personal 3 En 1 IN-45;Colecta de Mercado Envíos;MELI Logistics;MEL43259297660FMXDF01
Smart Watch Reloj Inteligente Z78 Ultra | Multi Funciones Color De La Caja Plateado TQ-80-J;Colecta de Mercado Envíos;MELI Logistics;MEL43261714108FMXDF01
Entrenador De Dedos, Potenciador De Agarre De Manos, 2 UnidaTalla : S-X-LGATO-8;Mercado Envíos Flex;TECHNOLOGYLUNAR20231128160211;43261708184
Teclas Numéricas Inalámbricas Bluetooth 3.5 De 2.4 GhzColor : NegroHG-M-50;Colecta de Mercado Envíos;MELI Logistics;MEL43261504725FMXDF01
Quita Pelos Mascotas Perros Ropa Removedor Pelos Lavadora Color Verde DARDOS-8;Mercado Envíos Flex;TECHNOLOGYLUNAR20231128160211;43261392509
Almohadilla Cojín Térmica Eléctrica Temperatura 6nivele60*30 Color Gris RC-M-58;Mercado Envíos Flex;TECHNOLOGYLUNAR20231128160211;43261955753
Cojin Silicona Gel Flexible Obsequio Gratis Funda ProtectoraColor : AzulRACO-15;Mercado Envíos Flex;TECHNOLOGYLUNAR20231128160211;43262396179
Ducha Portátil Para Camping Ducha Recargable Al Aire Libre ZKSO-40;Mercado Envíos Flex;TECHNOLOGYLUNAR20231128160211;43262364723
Maquina Peluquería Barbería Recargable Vgrv-276Color : Plateado | Voltaje : 110VZKYSO-83;Mercado Envíos Flex;TECHNOLOGYLUNAR20231128160211;43262289379
Mini Lavadora Portatil Usb 1kg Para Balde /e Color Blanco DARDOS-25;Mercado Envíos Flex;TECHNOLOGYLUNAR20231128160211;43262206787
Shaver Rasuradora Kemei Original Km-2027Color : Verde | Voltaje : 110VSOVO-M-56;Colecta de Mercado Envíos;Envia;MEL43262335300FMXDF01
Set Juego De Mesa Poker Texas Por 200 Fichas EH-28;Colecta de Mercado Envíos;MELI Logistics;MEL43263538264FMXDF01
Aire Acondicionado Portatil Refrigerador Personal Artic AirColor : BlancoGATO-30;Colecta de Mercado Envíos;MELI Logistics;MEL43262847670FMXDF01
Bocina Bluetooth Charge 4 Portatil Recargable Contra Agua - Azul SNVX-38F;Mercado Envíos Flex;TECHNOLOGYLUNAR20231128160211;43262355691
Esquinero Organizador De Ducha Multiuso 4 Repisas Ajustable Color Blanco RC-34;Colecta de Mercado Envíos;Envia;MEL43237856383FMXDF01
Barrera De Seguridad Para Bebes Barandas Escaleras Y PuertasColor : NegroSKSO-15;Colecta de Mercado Envíos;MELI Logistics;MEL43237643829FMXDF01
Manguera Magic Hose Expandible 30 Metros PistolaColor : AzulGTCH-24;Colecta de Mercado Envíos;MELI Logistics;MEL43237792594FMXDF01
Máquina Dispensadora De Póquer Mezclador De CartasColor del reverso : NegroEH-25;Colecta de Mercado Envíos;MELI Logistics;MEL43237767130FMXDF01
Batidora A Pilas Mezclador Manual Color Blanco FAK-7;Colecta de Mercado Envíos;MELI Logistics;MEL43237691888FMXDF01
Llave De Impacto De Potencia Inalámbrica, Destornillador,Color : Negro | Voltaje : 110V/220VFLLGZ-35F;Colecta de Mercado Envíos;MELI Logistics;MEL43237334695FMXDF01
Set 7 Piezas Mantel De ComedorColor : COLORES | Diseño de la tela : RayadoMVM-79;Colecta de Mercado Envíos;MELI Logistics;MEL43237292636FMXDF01
Cancha Fútbol Para Niños Doble 2 Arcos BalónColor : AzulFLLGANGAZO-39;Colecta de Mercado Envíos;MELI Logistics;MEL43237274040FMXDF01
Radiofrecuencia Facial Terapia - Unidad a $69000 RD ST-50;Colecta de Mercado Envíos;MELI Logistics;MEL43236927671FMXDF01
Cajas Organizadoras De Ropa Set X3 PzasColor : Gris oscuroDG-28-J;Colecta de Mercado Envíos;MELI Logistics;MEL43236839609FMXDF01
Espejo De Maquillaje Tocador Luz Led Recargable AjustableColor del marco : BlancoIN-16;Colecta de Mercado Envíos;MELI Logistics;MEL43236763516FMXDF01
Telefono Panasonic Fijo De Mesa Alambrico Ts500- 7700Color : BlancoZKSO-26F;Colecta de Mercado Envíos;MELI Logistics;MEL43236526613FMXDF01
Aire Acondicionado Portátil Enfriador Personal Usb ArcticColor : Blanco | Voltaje : 110V/220VRD ST-28;Colecta de Mercado Envíos;Envia;MEL43251556196FMXDF01
Cabina De Sonido 8 Pulgadas Profesional Activa Sonivox Ac708Color : NegroSV-200-J;Colecta de Mercado Envíos;MELI Logistics;MEL43251240631FMXDF01
Micrófono Shure Sv Sv200 Dinámico Cardioide Color Negro;Colecta de Mercado Envíos;MELI Logistics;MEL43251971944FMXDF01
Balde Plegable 10ltsen SiliconaColor : ColoresFAK-18;Colecta de Mercado Envíos;MELI Logistics;MEL43251753963FMXDF01
Soporte Base Tv 26 28 30 32 40 42 43 48 49 50 55 58 60 63Color : NegroIN-11;Colecta de Mercado Envíos;MELI Logistics;MEL43253932943FMXDF01
Maleta Para Mascotas ExpandibleColor : COLORESZKSO-80F;Colecta de Mercado Envíos;MELI Logistics;MEL43254074418FMXDF01
Alfombra Tapete Didáctica Abecedario Con Sonido Infantil TRQ-50;Colecta de Mercado Envíos;MELI Logistics;MEL43254044556FMXDF01
Batería Externa Inalámbrica Magsafe Battery Pack Para iPhone ONET-45;Colecta de Mercado Envíos;MELI Logistics;MEL43253899083FMXDF01
Convertidor De Potencia De 200 W Para Automóvil DTRNK-77F;Colecta de Mercado Envíos;MELI Logistics;MEL43253778456FMXDF01
Happy Bolsa De Dormir Sleeping Para NiñosColor : PERRO HUSKY GRISGTCH-35;Colecta de Mercado Envíos;MELI Logistics;MEL43253694132FMXDF01
Pulidora Inalambrica Kit Set Doble Bateria PortatilColor : DISEÑOTV-250;Colecta de Mercado Envíos;MELI Logistics;MEL43253563186FMXDF01
